seq,title,decision,reason,has_abstract
1389,Intra- and inter-regional expansion: a nonlinear model,UNSURE,auto:insufficient_evidence,N
1390,Family culture and organisational systems as antecedents of market orientation a,Y,"auto_abstract:quantitative_stat,ip_performance",Y
1395,FACTORS DETERMINING PROFITABILITY OF SMALL AND MEDIUM ENTERPRISES IN SELECTED IN,UNSURE,auto:insufficient_evidence,N
1396,The catalytic effect of internationalization on innovation,UNSURE,auto:insufficient_evidence,N
1399,Risk perceptions in Japanese SMEs: the role of Internet marketing capabilities i,UNSURE,auto:insufficient_evidence,N
1400,"Offshore outsourcing and firm performance: Moderating effects of size, growth an",UNSURE,auto:insufficient_evidence,N
1404,Which projects are selected for an innovation subsidy? The Portuguese case,UNSURE,auto:insufficient_evidence,N
1406,Corporate Social Responsibility in SMEs: Implications on Competitive Performance,UNSURE,auto:insufficient_evidence,N
1407,Family CEO and board service: Turning the tide for export scope in family SMEs,UNSURE,auto:insufficient_evidence,N
1408,Overseas Subsidiaries and the Productivity of Two-way Trading Manufacturers in G,UNSURE,auto:insufficient_evidence,Y
1409,"Pre-IPO growth, venture capital, and the long-run performance of IPOs",UNSURE,auto:insufficient_evidence,N
1411,Beauty Is in the Eye of the Beholder: Toward a Contextual Understanding of Compe,UNSURE,auto:insufficient_evidence,Y
1412,Antecedents of Inbound and Outbound M&A: Industry-Level Analysis from India,UNSURE,auto:insufficient_evidence,N
1414,Determinants of high-growth university spin-offs in Spain,UNSURE,auto:insufficient_evidence,N
1415,Women in the boardroom and corporate social performance: negotiating the double ,UNSURE,auto:insufficient_evidence,Y
1416,Performance vs. Family Ownership and Management: The Case of Portuguese Wine Fir,UNSURE,auto:insufficient_evidence,Y
1417,The Performance of High-Growers and Regional Entrepreneurial Ecosystems: A Resea,UNSURE,auto:insufficient_evidence,Y
1418,Supporting SMEs' internationalisation through a deeper understanding of human an,UNSURE,auto:insufficient_evidence,N
1419,Networking policy and firm performance,UNSURE,auto:insufficient_evidence,N
1420,Does TMT cultural diversity contribute to firm performance and do socialisation ,UNSURE,auto:insufficient_evidence,Y
1421,How nation-level background governance conditions shape the economic payoffs of ,UNSURE,auto:insufficient_evidence,Y
1426,Country-level corruption and accounting choice: Research & development capitaliz,UNSURE,auto:insufficient_evidence,N
1427,International Dispersion and Profitability: An Institution-Based Approach,UNSURE,auto:insufficient_evidence,N
1429,"Geographical diversification, firm size and profitability in Malaysia: A quantil",UNSURE,auto:insufficient_evidence,N
1430,Managing institutional voids: A configurational approach to understanding high p,UNSURE,auto:insufficient_evidence,N
1431,R&D Internationalization and Green Innovation? Evidence from Chinese Resource En,UNSURE,auto:insufficient_evidence,Y
1432,Top management team regional diversity and internationalization,UNSURE,auto:insufficient_evidence,Y
1435,Foreign acquisitions and firm performance: The moderating role of prior foreign ,UNSURE,auto:insufficient_evidence,N
1436,"Product Newness, Low Competition, Recent Technology, and Export Orientation as P",UNSURE,auto:insufficient_evidence,Y
1437,Are export promotion programs effective in promoting the internalization of SMEs,UNSURE,auto:insufficient_evidence,N
1438,Founder non-international experience and venture internationalization,UNSURE,auto:insufficient_evidence,N
1440,Effect of Internationalisation on Balanced Scorecard among Malaysian Small and M,UNSURE,auto:insufficient_evidence,Y
1441,Explaining the performance of divested overseas subsidiaries,UNSURE,auto:insufficient_evidence,N
1442,Improving the financial performance of SMEs The presence in foreign markets and ,UNSURE,auto:insufficient_evidence,N
1444,The impact of intellectual capital. organizational capabilities and innovation o,UNSURE,auto:insufficient_evidence,Y
1445,The Invisible Hand of Evolutionary Psychology: The Importance of Kinship in Firs,UNSURE,auto:insufficient_evidence,Y
1447,Impact of E-Commerce Sales on Profitability and Revenue. The Case of the Manufac,UNSURE,auto:insufficient_evidence,Y
1448,The relationships between the internationalization of alliance portfolio diversi,UNSURE,auto:insufficient_evidence,N
1449,The growing importance of KIBS in today's economy,UNSURE,auto:insufficient_evidence,N
1450,How to use your social capital to thrive in export markets? Identifying the dyna,UNSURE,auto:insufficient_evidence,N
1451,Job Creation of Exporters and Non-exporters: Evidence from Estonia,UNSURE,auto:insufficient_evidence,N
1452,Home Country Institutional Context and Entrepreneurial Internationalization: The,UNSURE,auto:insufficient_evidence,N
1453,"Using the ""best-fit"" approach to investigate the effects of politico-economic an",UNSURE,auto:insufficient_evidence,Y
1456,Intellectual capital based reputation for market internationalization The case o,UNSURE,auto:insufficient_evidence,N
1458,Exploring performance of software houses Market orientation and mediating role o,UNSURE,auto:insufficient_evidence,N
1459,The export additionality of innovation policy,UNSURE,auto:insufficient_evidence,N
1460,Exploring the organizing and strategic factors of diasporic transnational entrep,UNSURE,auto:insufficient_evidence,N
1462,"Impact of Innovation Culture, Organization Size and Technological Capability on ",Y,"auto_abstract:quantitative_stat,ip_performance",Y
1463,Who does it best? Family and nonfamily owners and leaders navigating institution,UNSURE,auto:insufficient_evidence,N
1464,How to optimize the allocation of research resources? An empirical study based o,UNSURE,auto:insufficient_evidence,N
1465,Local linkages: The interdependence of foreign and domestic firms in Ireland,UNSURE,auto:insufficient_evidence,N
1467,The effect of CEO incentives on deviations from institutional norms in foreign m,UNSURE,auto:insufficient_evidence,Y
1468,Growth Strategies of Media Companies: Efficiency Analysis,UNSURE,auto:insufficient_evidence,N
1472,Impact of Logistics Capacity on Economic Sustainability of SMEs,Y,"auto_abstract:quantitative_stat,ip_performance",Y
1473,Downstream offshoring and firm-level employment,UNSURE,auto:insufficient_evidence,Y
1476,Entrepreneurial finance and new venture success - the moderating role of governm,UNSURE,auto:insufficient_evidence,Y
1479,The internationalization of new ventures in an emerging economy: The shifting ro,UNSURE,auto:insufficient_evidence,N
1480,Dimensional Impact of Social Capital on Financial Performance of SMEs,Y,"auto_abstract:quantitative_stat,ip_performance",Y
1482,Internet and SMEs' internationalization: The role of platform and website,UNSURE,auto:insufficient_evidence,N
1483,Examining economic and technology-related barriers of small- and medium-sized en,UNSURE,auto:insufficient_evidence,Y
1484,ADDRESSING THE PAUCITY OF MANAGEMENT KNOWLEDGE IN AFRICA,UNSURE,auto:insufficient_evidence,N
1485,"Knowledge, robots and productivity in SMEs: Explaining the second digital wave",UNSURE,auto:insufficient_evidence,N
1486,The Impact of Entrepreneurial Orientation on Foreign Market Entry: the Roles of ,UNSURE,auto:insufficient_evidence,N
1487,Entrepreneur's political involvement and inter-organizational conflict resolutio,UNSURE,auto:insufficient_evidence,N
1488,Impact of policy initiatives and collaborative synergy on sustainability and bus,UNSURE,auto:insufficient_evidence,Y
1489,Improving productivity of a financial firm: business model evolution in the Cari,UNSURE,auto:insufficient_evidence,N
1490,Linking governance structure and sustainable operations of Chinese manufacturing,UNSURE,auto:insufficient_evidence,N
1493,"Relational ownership, institutional context, and internationalization of state-o",UNSURE,auto:insufficient_evidence,Y
1495,The effect of entrepreneurial origin on firms' performance: the case of Portugue,UNSURE,auto:insufficient_evidence,Y
1497,"Heterogeneous firms, corporate taxes and export behavior: A firm-level investiga",UNSURE,auto:insufficient_evidence,N
1499,The impact of the 2008 financial crisis on innovation: A dominant design perspec,UNSURE,auto:insufficient_evidence,N
1500,Exploring the antecedents of franchise internationalization,UNSURE,auto:insufficient_evidence,N
1502,The influence of internet marketing capabilities on international market perform,UNSURE,auto:insufficient_evidence,Y
1504,The mediating role of speed in the global sourcing decision process,UNSURE,auto:insufficient_evidence,N
1507,Development of entrepreneurial orientation of export manufacturers from emerging,UNSURE,auto:insufficient_evidence,N
1508,OUTWARD INTERNATIONALISATION OF EMERGING MARKET SMALL AND MEDIUM SIZED ENTERPRIS,UNSURE,auto:insufficient_evidence,Y
1509,Corporate innovation and environmental investment: The moderating role of instit,UNSURE,auto:insufficient_evidence,Y
1510,Does institutional industry context matter to performance? An extension of the i,UNSURE,auto:insufficient_evidence,N
1513,"Re-examining Strategic Flexibility: A Meta-Analysis of its Antecedents, Conseque",N,auto_title:meta-analysis_paper,Y
1514,The international market selection of Chinese SMEs: How institutional influence ,UNSURE,auto:insufficient_evidence,N
1515,Trade Integration in Colombia: A Dynamic General Equilibrium Study with New Expo,UNSURE,auto:insufficient_evidence,N
1516,Sourcing Technological Knowledge Through Foreign Inward Licensing to Boost the P,UNSURE,auto:insufficient_evidence,Y
1517,Quality certifications' impact on wine industry assets performance,UNSURE,auto:insufficient_evidence,N
1518,Transformational Leadership's Impact on Organizational Innovation: The Mediating,UNSURE,auto:insufficient_evidence,N
1519,"International Network Searching, Learning, and Explorative Capability: Small and",UNSURE,auto:insufficient_evidence,N
1521,The Influence of R&D Intensity on Financial Performance: The Mediating Role of H,UNSURE,auto:insufficient_evidence,N
1522,How companies respond to growing research costs: cost control or value creation?,UNSURE,auto:insufficient_evidence,Y
1524,"Institutional complementarity, firm behavior, and firm heterogeneity: A cross-na",UNSURE,auto:insufficient_evidence,Y
1527,Product diversification and large construction firm productivity: the effect of ,Y,"auto_abstract:quantitative_method,ip_performance",Y
1528,The price tag of technologies and the 'unobserved' R&D capabilities of firms,UNSURE,auto:insufficient_evidence,N
1530,Organisational learning as a mediator in the host-home country similarity-intern,UNSURE,auto:insufficient_evidence,Y
1533,"Dynamic Capabilities, Environmental Dynamism and Small and Medium Enterprises' I",UNSURE,auto:insufficient_evidence,N
1534,The competitive efficiency of Costa Rican small and medium-sized businesses: a d,UNSURE,auto:insufficient_evidence,Y
1537,THE EFFECT OF THE USE OF SOCIAL MEDIA AND DYNAMIC CAPABILITIES ON MARKET PERFORM,UNSURE,auto:insufficient_evidence,N
1542,The combined effects of product and geographical diversification on performance:,UNSURE,auto:insufficient_evidence,Y
1543,"Management, productivity and firm heterogeneity in international trade",UNSURE,auto:insufficient_evidence,N
1545,Globalization and the labor share in China: Firm-level evidence,UNSURE,auto:insufficient_evidence,N
1546,Antecedents to differentiation strategy in the exporting SME,UNSURE,auto:insufficient_evidence,N
1548,Understanding the connection between SMEs' competitiveness and cash flow generat,Y,"auto_abstract:quantitative_stat,ip_performance",Y
1552,"Limiting role of resource dependence: an examination of director interlocks, boa",UNSURE,auto:insufficient_evidence,Y
1553,Processing trade and energy efficiency: Evidence from Chinese manufacturing firm,UNSURE,auto:insufficient_evidence,N
1555,"Human capital readiness and global market orientation in Indonesian Micro-, Smal",UNSURE,auto:insufficient_evidence,Y
1556,Waiting for Godot? Success or failure of firms' growth in a panel of Italian man,UNSURE,auto:insufficient_evidence,N
1557,"Past, ongoing, and future debate on the interplay between internationalization a",UNSURE,auto:insufficient_evidence,Y
1562,Ownership structure and financial performance of Spanish port service companies,UNSURE,auto:insufficient_evidence,N
1566,"Chief global officers, geographical sales dispersion, and firm performance",UNSURE,auto:insufficient_evidence,N
1567,Women directors and exporting activity: The moderating role of network advice,UNSURE,auto:insufficient_evidence,Y
1569,The Export Quality and Firm Heterogeneity of the Food Industry in China,UNSURE,auto:insufficient_evidence,N
1570,Adoption timing of OHSAS 18001 and firm performance: An institutional theory per,UNSURE,auto:insufficient_evidence,N
1571,"Industry 4.0 technologies, digital trust and technological orientation: What mat",UNSURE,auto:insufficient_evidence,N
1573,New product development and sustainable performance of Chinese SMMEs: The role o,UNSURE,auto:insufficient_evidence,N
1574,Chief marketing officer and internationalization-a resource-based view,UNSURE,auto:insufficient_evidence,Y
1575,The effect of board gender diversity on cross-listing,UNSURE,auto:insufficient_evidence,N
1576,Maritime knowledge clusters: A conceptual model and empirical evidence,UNSURE,auto:insufficient_evidence,N
1580,THE IMPACT OF GENDER ON FINANCIAL PERFORMANCE: EVIDENCE FROM A SAMPLE OF PORTUGU,Y,"auto_abstract:quantitative_method,quantitative_stat,ip_performance",Y
1581,Examining the Factors Affecting SME Performance: The Mediating Role of Social Me,UNSURE,auto:insufficient_evidence,Y
1582,Impact of institutional imprinting on the persistence of superior profits: A stu,UNSURE,auto:insufficient_evidence,N
1584,The effect of information frictions on FDI persistence,UNSURE,auto:insufficient_evidence,N
1585,Measuring competitiveness through the global competitiveness project framework: ,Y,"auto_abstract:quantitative_stat,ip_performance",Y
1586,Business founders and performance of family firms: evidence from developing coun,Y,"auto_abstract:quantitative_stat,ip_performance",Y
1587,Measuring innovation effectiveness: a SEM-based cross-lagged analysis,UNSURE,auto:insufficient_evidence,Y
1588,Swimming upstream throughout the turmoil: Evidence on firm growth during the gre,UNSURE,auto:insufficient_evidence,Y
1591,Innovation drivers of external competitiveness in the great recession,UNSURE,auto:insufficient_evidence,Y
1592,Migrant human and political capitals value in entrepreneur enterprise performanc,UNSURE,auto:insufficient_evidence,Y
1593,Exports of Spanish manufacturing firms and financial constraints,UNSURE,auto:insufficient_evidence,N
1596,"Informal institutions, entrepreneurs' political participation, and venture inter",UNSURE,auto:insufficient_evidence,N
1597,"Innovation and exports: different markets, different outcomes",UNSURE,auto:insufficient_evidence,N
1601,How to Increase the Internationalization Capacity of Science & Technology Park F,UNSURE,auto:insufficient_evidence,Y
1602,On the relationship between the energy conservation and emissions reduction poli,UNSURE,auto:insufficient_evidence,N
1605,The influence of the five cardinal values of confucianism on firm performance,UNSURE,auto:insufficient_evidence,N
1606,Emerging Market Multinational Family Business Groups and the Use of Family Manag,UNSURE,auto:insufficient_evidence,Y
1608,Does age matter? The impact of SMEs age on the relationship between knowledge so,UNSURE,auto:insufficient_evidence,N
1611,Building Multinationals in the Mediterranean: balearic island hotels in the 1990,UNSURE,auto:insufficient_evidence,Y
1612,Do firms profit from patent litigation? The contingent roles of diversification ,UNSURE,auto:insufficient_evidence,N
1613,Does one size fit all? CEO profiles and strategic management choices,UNSURE,auto:insufficient_evidence,Y
1614,"Strategic agility, dynamic relational capability and trust among SMEs in transit",UNSURE,auto:insufficient_evidence,N
1615,Reverse innovation transfer in Chinese MNCs: The role of political ties and head,UNSURE,auto:insufficient_evidence,Y
1616,"Strategic agility, internationalisation speed and international success - The ro",UNSURE,auto:insufficient_evidence,N
1617,Resources and digital export: An RBV perspective on the role of digital technolo,UNSURE,auto:insufficient_evidence,N
1619,The short- and long-run effects of foreign investments on firm performance: Evid,UNSURE,auto:insufficient_evidence,N
1620,Implementation of Stochastic Analysis in Corporate Decision-Making Models,UNSURE,auto:insufficient_evidence,Y
1621,Broadening the business model construct: Exploring how family-owned SMEs co-crea,UNSURE,auto:insufficient_evidence,N
1622,Assessing the Innovation-finance Nexus for SMEs: Evidence from the Arab Region (,UNSURE,auto:insufficient_evidence,N
1624,Bridging production factors allocation and sustainable operations in China's hea,UNSURE,auto:insufficient_evidence,N
1627,The birth of new HGEs: internationalization through new digital technologies,UNSURE,auto:insufficient_evidence,N
1628,Versatile capabilities for growth in the context of transforming countries: Evid,UNSURE,auto:insufficient_evidence,N
1631,Exploring firm-level innovation and productivity in India,UNSURE,auto:insufficient_evidence,Y
1632,Determining factors of financial performance of agricultural listed companies in,UNSURE,auto:insufficient_evidence,N
1633,Dynamic capabilities and high-tech entrepreneurial ventures' performance in the ,UNSURE,auto:insufficient_evidence,N
1634,Competitive efficiency in Catalonia: a non-parametric study of the competitivene,UNSURE,auto:insufficient_evidence,N
1636,The impact of market orientation on the performance of MSMEs operating in techno,UNSURE,auto:insufficient_evidence,Y
1640,Validating multidimensional entrepreneurial orientation in emerging economies,Y,"auto_abstract:quantitative_stat,ip_performance",Y
1641,An Investigation of Entrepreneurial SMEs' Network Capability and Social Capital ,UNSURE,auto:insufficient_evidence,Y
1642,The Micro-Foundation of Ambidextrous Foreign Direct Investment,UNSURE,auto:insufficient_evidence,Y
1643,"Political connection, contract intensity, and OFDI: Evidence from China",UNSURE,auto:insufficient_evidence,Y
1645,Is small and medium-sized beautiful? The structure and evolution of family SMEs ,UNSURE,auto:insufficient_evidence,Y
1646,The contribution of the external director for Brazilian private family business:,Y,"auto_abstract:quantitative_method,quantitative_stat",Y
1649,EFFECT OF INDIVIDUAL ENTREPRENEURSHIP ORIENTATION ON EXPORT INTENTION IN MICRO A,UNSURE,auto:insufficient_evidence,N
1650,The relationship between cross-border acquisitions and R&D investments by Indian,Y,"auto_abstract:quantitative_method,quantitative_stat",Y
1651,"Organisational commitment, intentions to quit, intellectual capital and firm's m",UNSURE,auto:insufficient_evidence,N
1652,Export activities and the demand for skills in German businesses,UNSURE,auto:insufficient_evidence,N
1657,Is Internationalization Beneficial to Innovation? Evidence from a Meta-analysis,N,auto_title:meta-analysis_paper,Y
1658,Chairpersons' hubris and internationalization: evidence from emerging market's f,UNSURE,auto:insufficient_evidence,Y
1660,Information and Communication Technology Adoption Strategies of Emerging Multina,UNSURE,auto:insufficient_evidence,Y
1662,Efficacy of Marketing in Innovation Processes,UNSURE,auto:insufficient_evidence,Y
1663,Formal and informal influences of the state on OFDI of hybrid state-owned enterp,UNSURE,auto:insufficient_evidence,N
1664,Environmental sustainability practices and offshoring activities of multinationa,UNSURE,auto:insufficient_evidence,N
1665,Internationalization-Innovation Strategy in New Ventures: A Log-linear Analysis,UNSURE,auto:insufficient_evidence,Y
1667,Challenging the knowledge resources complementarity hypothesis: a counterexample,UNSURE,auto:insufficient_evidence,N
1671,"International Diversification, Tax Avoidance, and Chaebol: Evidence from Korea",UNSURE,auto:insufficient_evidence,N
1673,Going global: Factors influencing the internationalization of the internal audit,UNSURE,auto:insufficient_evidence,N
1676,Does organizational learning differ in manufacturing and service firms? Evidence,UNSURE,auto:insufficient_evidence,Y
1678,International R&D teams: Performance effects and the moderating role of technolo,Y,"auto_abstract:quantitative_method,quantitative_stat",Y
1682,"One country, many industries: Heterogeneity of Chinese OFDI motivations at meso ",UNSURE,auto:insufficient_evidence,N
1683,Which export channels provide real options to SMEs?,UNSURE,auto:insufficient_evidence,Y
1684,Gaijin invasion? A resource dependence perspective on foreign ownership and fore,UNSURE,auto:insufficient_evidence,N
1685,"Examining antecedents, consequences, and contingencies of proactive environmenta",UNSURE,auto:insufficient_evidence,N
1687,The role of the SDGs as enhancers of the performance of Spanish wine cooperative,UNSURE,auto:insufficient_evidence,N
1688,"Top management team heterogeneity, corporate social responsibility and firm risk",Y,"auto_abstract:quantitative_method,quantitative_stat,ip_performance",Y
1689,The Internationalization and Voluntary Adoption of International Accounting Stan,UNSURE,auto:insufficient_evidence,N
1690,Connecting the Dots: Exploring the Knowledge-based Antecedents of SMEs' Profitab,UNSURE,auto:insufficient_evidence,Y
1691,"Social capital and internationalization of family SMEs in Campeche, Mexico: a qu",UNSURE,auto:insufficient_evidence,N
1694,Examining the determinants of small firms' performance in India,UNSURE,auto:insufficient_evidence,N
1695,Leveraging the benefits of location decisions into performance: A global view fr,UNSURE,auto:insufficient_evidence,N
1699,CEO Foreign Experience and Green Innovation: Evidence from China,UNSURE,auto:insufficient_evidence,N
1701,China's new research evaluation policy: Evidence from economics faculty of Elite,UNSURE,auto:insufficient_evidence,N
1702,Intermediary Management and Employee Corporate Culture Identification Mediation ,UNSURE,auto:insufficient_evidence,Y
1703,Sustaining superior international performance: Strategic orientations and dynami,UNSURE,auto:insufficient_evidence,Y
1704,"Regional development, innovation systems and service companies' performance",UNSURE,auto:insufficient_evidence,N
1705,"Role of educational, regional and religious attributes of CEOs in performance of",Y,"auto_abstract:quantitative_method,quantitative_stat,ip_performance",Y
1707,The coevolution of international scope and technological knowledge in MNCs,UNSURE,auto:insufficient_evidence,N
1708,Impact of knowledge-based capital on firm productivity: The contingent effect of,UNSURE,auto:insufficient_evidence,N
1711,Knowledge assets for internationalization strategy proposal,UNSURE,auto:insufficient_evidence,N
1712,CHINESE FOREIGN TRANSACTIONS: WHAT GETS THEM IN TROUBLE?,UNSURE,auto:insufficient_evidence,Y
1713,Innovation Promoter or Inhibitor? Non-Family CEO's Effect on Innovation in Famil,UNSURE,auto:insufficient_evidence,N
1715,Effect of buyer dependency of subcontracting SMEs on R&D investment,UNSURE,auto:insufficient_evidence,N
1716,Does entrepreneurial orientation encourage Pakistani SMEs to participate in Chin,UNSURE,auto:insufficient_evidence,N
1717,Dual institutional embeddedness and home country CSR Engagement: Evidence from I,UNSURE,auto:insufficient_evidence,N
1718,Exploratory and Exploitative Internationalization: Effects of Social Capital Ant,UNSURE,auto:insufficient_evidence,Y
1725,Does internationalization encourage state-owned enterprises to utilize subsidies,Y,"auto_abstract:quantitative_method,quantitative_stat",Y
1726,Innovation adaptation and post-entry growth in international new ventures,UNSURE,auto:insufficient_evidence,N
1729,Internationalization pathways of Chinese private firms: A closer look at firm-sp,UNSURE,auto:insufficient_evidence,N
1730,Home country learning and international expansion of emerging market multination,UNSURE,auto:insufficient_evidence,N
1731,The impact of home and host country institutional development on multinationals',UNSURE,auto:insufficient_evidence,N
1734,"Are institutional investors ""in love"" with the sustainable development goals? Un",UNSURE,auto:insufficient_evidence,N
1735,The role of human capital in the foreign market performance of US SMEs: does own,UNSURE,auto:insufficient_evidence,Y
1736,Leadership in internationalization strategies,UNSURE,auto:insufficient_evidence,Y
1740,Multinational enterprises' internationalization and adoption of sustainable deve,Y,"auto_abstract:quantitative_method,quantitative_stat",Y
1741,Dealing with the tensions between innovation and internationalization in SMEs: A,UNSURE,auto:insufficient_evidence,N
1743,The drivers of successful regional expansion: evidence from multinational corpor,UNSURE,auto:insufficient_evidence,N
1745,Network exploration and exploitation capabilities and foreign market knowledge: ,UNSURE,auto:insufficient_evidence,N
1746,Capital flight for family? Exploring the moderating effects of social connection,UNSURE,auto:insufficient_evidence,N
1751,Toward a more in-depth measurement of cultural distance: A re-evaluation of the ,UNSURE,auto:insufficient_evidence,Y
1752,Belt and Road Initiative and OFDI from China: the paradox of home country instit,UNSURE,auto:insufficient_evidence,Y
1754,The Influence of Top Management Team Human Capital on Sustainable Business Growt,UNSURE,auto:insufficient_evidence,Y
