seq,title,decision,reason,has_abstract
1034,The determinants of efficiency and productivity in the Swiss insurance industry,UNSURE,auto:insufficient_evidence,N
1035,The integration of quality and safety concerns in the wine industry: the role of,UNSURE,auto:insufficient_evidence,N
1036,Are Firms in Developing Countries in Spider Webs or Iron Cages? Geographic Traps,Y,"auto_abstract:ip_performance,ip_internationaliz",Y
1037,Assembling capabilities for innovation: Evidence from New Zealand SMEs,UNSURE,auto:insufficient_evidence,Y
1038,"Organizational learning, entrepreneurial orientation, and the role of university",UNSURE,auto:insufficient_evidence,Y
1039,Food exporters in global value chains: Evidence from Italy,UNSURE,auto:insufficient_evidence,N
1042,Understanding Export Market Success: Evidence from Manufacturing Firms,UNSURE,auto:insufficient_evidence,N
1043,International knowledge spillovers through high-tech imports and R&D of foreign-,UNSURE,auto:insufficient_evidence,Y
1045,SMEs and social capital: exploring the Brazilian context,UNSURE,auto:insufficient_evidence,N
1046,Effects of Network Capabilities on Firm Performance across Cultures,UNSURE,auto:insufficient_evidence,Y
1047,"Directors' human capital, firm strategy, and firm performance",UNSURE,auto:insufficient_evidence,N
1048,Measuring the Magnitude of Significant Market Power in the Manufacturing and Ser,UNSURE,auto:insufficient_evidence,N
1049,. Maximizing the Benefits of Internationalization: The Moderating Role of Labour,UNSURE,auto:insufficient_evidence,Y
1050,"Political Connections, Home Formal Institutions, and Internationalization: Evide",UNSURE,auto:insufficient_evidence,Y
1051,Internationalization choices: an ordered probit analysis at industry level,UNSURE,auto:insufficient_evidence,N
1052,The interactive effect of time and host country location on Chinese MNCs' perfor,UNSURE,auto:insufficient_evidence,N
1053,How valuable is information and communication technology? A study of emerging ec,UNSURE,auto:insufficient_evidence,N
1054,What is beneficial for first-time SME-exporters from a transition economy: A div,UNSURE,auto:insufficient_evidence,N
1056,The international diversification-performance link in Spain: Does firm size real,UNSURE,auto:insufficient_evidence,N
1057,Performance of professional service firms from emerging markets: Role of innovat,UNSURE,auto:insufficient_evidence,N
1062,When distance does not matter: Implications for Latin American multinationals,UNSURE,auto:insufficient_evidence,N
1065,Factors influencing the implementation of diversity management in business organ,UNSURE,auto:insufficient_evidence,N
1066,Too much of a good thing: Does international experience variety accelerate or de,UNSURE,auto:insufficient_evidence,N
1067,"It is not whom you know, it is how well you know them: Foreign entrepreneurs bui",UNSURE,auto:insufficient_evidence,N
1068,Multinationality as real option facilitator - Illusion or reality?,UNSURE,auto:insufficient_evidence,N
1070,Market Timing and Internationalization Decisions: A Contingency Perspective,UNSURE,auto:insufficient_evidence,N
1071,The interaction of chief executive officer and top management team on organizati,UNSURE,auto:insufficient_evidence,N
1072,International diversification and corporate social responsibility An empirical s,UNSURE,auto:insufficient_evidence,N
1073,A reversal theory in internationalization: case of Korean jewelry inside China,Y,"auto_abstract:quantitative_stat,ip_performance",Y
1074,Efficiency of organic farming companies that operate in an online environment,UNSURE,auto:insufficient_evidence,N
1075,"Which ""green"" is better? An empirical study of the impact of green activities on",UNSURE,auto:insufficient_evidence,N
1076,SUSTAINABILITY IN RELATIONSHIP MARKETING: AN EXPLORATORY MODEL FOR THE INDUSTRIA,UNSURE,auto:insufficient_evidence,Y
1078,Drivers of Global CSR Integration and Local CSR Responsiveness: Evidence from Ch,UNSURE,auto:insufficient_evidence,Y
1080,Broadening or jumping? An analysis of the first export market of European Union ,UNSURE,auto:insufficient_evidence,Y
1082,How does regional institutional complexity affect MNE internationalization?,UNSURE,auto:insufficient_evidence,N
1083,Internet marketing capabilities and international market growth,UNSURE,auto:insufficient_evidence,N
1084,Perspectives on strategic internationalization: Developing capabilities for rene,UNSURE,auto:insufficient_evidence,N
1085,Geographical diversification as a predictor of MNC reputations in their home nat,UNSURE,auto:insufficient_evidence,N
1086,IT-enabled Knowledge Management for the Competitive Performance of Manufacturing,UNSURE,auto:insufficient_evidence,Y
1087,"Foreign direct investment, domestic sales and exports of local firms: a regional",UNSURE,auto:insufficient_evidence,N
1088,Cross-border acquisitions by Indian multinationals: Asset exploitation or asset ,UNSURE,auto:insufficient_evidence,N
1089,The effect of a geographically dispersed supply base on downside risk: Developin,UNSURE,auto:insufficient_evidence,N
1093,Does policy reform promote FDI in developing economies? a firm-level simulation ,UNSURE,auto:insufficient_evidence,N
1094,"Relational structure in the global automotive industry: groups, networks and fie",UNSURE,auto:insufficient_evidence,N
1095,The Moderating Effect of Perceived Effectiveness of SMEs' Marketing Function on ,UNSURE,auto:insufficient_evidence,N
1097,Does Freer Trade <i>Really</i> Lead to Productivity Growth? Evidence from Africa,UNSURE,auto:insufficient_evidence,N
1101,Innovation and experiential knowledge in firm exports: Applying the initial U-mo,UNSURE,auto:insufficient_evidence,Y
1103,Ownership control of foreign affiliates: A property rights theory perspective,UNSURE,auto:insufficient_evidence,Y
1104,Firm-specific intangible assets and subsidiary profitability: The moderating rol,UNSURE,auto:insufficient_evidence,N
1105,Decisions of OFDI Engagement and Location for Heterogeneous Multinational firms:,UNSURE,auto:insufficient_evidence,N
1106,Entrepreneurial orientation and performance: mediating effects of technology and,UNSURE,auto:insufficient_evidence,Y
1108,The internationalization of SMEs in Italy,UNSURE,auto:insufficient_evidence,Y
1109,"Financial constraints and firm exports: accounting for heterogeneity, self-selec",UNSURE,auto:insufficient_evidence,N
1110,Resource based view of internationalization: evidence from Indian commercial ban,Y,"auto_abstract:quantitative_method,quantitative_stat",Y
1111,Institutional effect on born global firms in China: the role of Sun Tzu's <i>The,UNSURE,auto:insufficient_evidence,N
1113,Explaining intermittent exporting: Exit and conditional re-entry in export marke,UNSURE,auto:insufficient_evidence,Y
1114,The impact of cultural diversity in corporate boards on firm performance,UNSURE,auto:insufficient_evidence,N
1116,Market driving strategies: Beyond localization,UNSURE,auto:insufficient_evidence,N
1121,The relationship between innovation and export behaviour: The case of Galician f,UNSURE,auto:insufficient_evidence,N
1122,OVERCOMING HUMAN CAPITAL VOIDS IN UNDERDEVELOPED COUNTRIES,UNSURE,auto:insufficient_evidence,N
1123,ICT as facilitator of internationalisation in small- and medium-sized firms,UNSURE,auto:insufficient_evidence,N
1125,Exploring the link between internationalization of top management and accounting,UNSURE,auto:insufficient_evidence,N
1126,Does state ownership facilitate outward FDI of Chinese SOEs? Institutional devel,UNSURE,auto:insufficient_evidence,N
1127,The impact of internationalization on innovation at countries' level: the role o,UNSURE,auto:insufficient_evidence,N
1130,Does stronger intellectual property rights protection matter in developing local,UNSURE,auto:insufficient_evidence,N
1131,Marketized state ownership and foreign expansion of emerging market multinationa,UNSURE,auto:insufficient_evidence,N
1134,INNOVATIVE BORN GLOBALS: INVESTIGATING THE INFLUENCE OF THEIR BUSINESS MODELS ON,N,auto_abstract:qualitative_method,Y
1136,Regional Endogenous Development Based on Conceptualizing a Regional Productivity,UNSURE,auto:insufficient_evidence,N
1137,Working capital management practices in India: survey evidence,Y,"auto_abstract:ip_performance,ip_internationaliz",Y
1138,INTERNATIONALIZATION STRATEGIES IN OLIGOPOLY WITH HETEROGENEOUS FIRMS,UNSURE,auto:insufficient_evidence,Y
1141,Institutional fragility and outward foreign direct investment from China,UNSURE,auto:insufficient_evidence,N
1142,ACQUISITION OR GREENFIELD ENTRY INTO AFRICA? RESPONDING TO INSTITUTIONAL DYNAMIC,UNSURE,auto:insufficient_evidence,Y
1143,Commercialization strategy and internationalization outcomes in technology-based,UNSURE,auto:insufficient_evidence,N
1144,Subsidies with export share requirements in China,UNSURE,auto:insufficient_evidence,N
1145,Capital investment and internationalization,UNSURE,auto:insufficient_evidence,N
1146,Determinants Of Productivity Of Ukrainian Firms,UNSURE,auto:insufficient_evidence,Y
1149,Constructing useful models of firms' heterogeneities in implemented strategies a,UNSURE,auto:insufficient_evidence,N
1150,Managerial Suggestions to Sustainable Market Choices: A Business Profitability A,UNSURE,auto:insufficient_evidence,N
1152,Emerging multinationals investing in developed countries Key factors for a succe,UNSURE,auto:insufficient_evidence,N
1153,Knowledge motives in the cross-border acquisitions A case research of three Braz,UNSURE,auto:insufficient_evidence,N
1154,Sales nationality and debt financing impact on firm's performance and risk Evide,UNSURE,auto:insufficient_evidence,N
1155,Born Globals-Is there fire behind the smoke?,UNSURE,auto:insufficient_evidence,N
1156,ANALYSIS OF THE INVESTMENT ACTIVITY IN SOUTH AND CENTRAL EASTERN EUROPE. A COMPA,UNSURE,auto:insufficient_evidence,Y
1157,Building international business bridges in geographically isolated areas: The ro,UNSURE,auto:insufficient_evidence,N
1159,International expansion and unobserved heterogeneity in critical success factors,UNSURE,auto:insufficient_evidence,N
1162,The impact of the top management teams' knowledge and experience on strategic de,UNSURE,auto:insufficient_evidence,N
1164,Transnationality and Financial Performance in the Era of the Global Factory,UNSURE,auto:insufficient_evidence,N
1165,The Impact of Regional and Institutional Factors on Labor Productive Performance,UNSURE,auto:insufficient_evidence,N
1167,The role of context-specific factors in IFDI's influence on OFDI of developing c,UNSURE,auto:insufficient_evidence,N
1168,The Internationalisation of Family Firms: the Role of the Ownership Structure an,UNSURE,auto:insufficient_evidence,Y
1170,The entrepreneurial influence on winery market performance - a mediation perspec,UNSURE,auto:insufficient_evidence,Y
1172,Are International and Product Diversification Substitutes or Complements? Theore,UNSURE,auto:insufficient_evidence,Y
1173,"Exploring the Relationship of Innovation Intensity, Knowledge Production and Pro",UNSURE,auto:insufficient_evidence,N
1174,Emerging Market Multinational Companies and Internationalization: The Role of Ho,UNSURE,auto:insufficient_evidence,N
1175,CO<sub>2</sub> emission intensity and exporting: Evidence from firm-level data,UNSURE,auto:insufficient_evidence,N
1176,Do firms with more alliance experience outperform others with less? A three-leve,UNSURE,auto:insufficient_evidence,Y
1178,Knowledge spillovers and high-impact growth: Comparing local and foreign firms i,UNSURE,auto:insufficient_evidence,N
1179,"Influence of the lack of a standard definition of ""family business"" on research ",UNSURE,auto:insufficient_evidence,Y
1180,Internationalization and Auditor Choice,UNSURE,auto:insufficient_evidence,N
1185,Encouraging Internationalization and Entrepreneurial Orientation in Small and Me,UNSURE,auto:insufficient_evidence,Y
1186,ANTECEDENTS AND OUTCOMES OF A GLOBAL MINDSET: A THEMATIC ANALYSIS OF RESEARCH FR,N,auto_abstract:qualitative_method,Y
1188,"MNE internationalization patterns, the roles of knowledge stocks, and the portfo",UNSURE,auto:insufficient_evidence,N
1192,Learning breakdown in latecomer multinational enterprises,UNSURE,auto:insufficient_evidence,N
1193,Financial Factors and Manufacturing Exports: Firm-Level Evidence From Egypt,UNSURE,auto:insufficient_evidence,N
1194,Intellectual property rights protection and technological innovation The moderat,UNSURE,auto:insufficient_evidence,N
1196,Firm Heterogeneity and Trade-Policy Stances <i>Evidence from a Survey of Japanes,UNSURE,auto:insufficient_evidence,Y
1198,Reputation of multinational companies Corporate social responsibility and intern,UNSURE,auto:insufficient_evidence,N
1200,"Agglomeration externalities, competition and productivity: empirical evidence fr",UNSURE,auto:insufficient_evidence,N
1203,Globalisation and the decline of the labour share: A microeconomic perspective,UNSURE,auto:insufficient_evidence,N
1205,"R&D, foreign ownership, and corporate groups: Evidence from Japanese firms",UNSURE,auto:insufficient_evidence,N
1207,LOOKING FOR ALLIANCE PORTFOLIO CHARACTERISTICS The Case of Telecom Industry,UNSURE,auto:insufficient_evidence,N
1209,International and product diversification: Which strategy suits family managers?,UNSURE,auto:insufficient_evidence,Y
1214,The labour market effects of offshoring of small and medium-sized firms: micro-l,UNSURE,auto:insufficient_evidence,Y
1215,Outward foreign direct investment: the Indian experience,UNSURE,auto:insufficient_evidence,N
1217,A data-driven analysis of the current debate on the linkages between performance,UNSURE,auto:insufficient_evidence,N
1221,The links between firm-level productivity and modes of international expansion o,UNSURE,auto:insufficient_evidence,Y
1222,Strategic resource decisions to enhance the performance of global engineering se,UNSURE,auto:insufficient_evidence,N
1224,Trade and Growth in the New Member States: The Role of Global Value Chains,UNSURE,auto:insufficient_evidence,N
1225,Market performance implications of modularization: Evidence from global auto fir,UNSURE,auto:insufficient_evidence,N
1227,REFLECTION OF THE DEGREE OF INTERATIONALIZATION IN THE ABSORPTION CAPACITY OF TH,UNSURE,auto:insufficient_evidence,N
1228,The analysis of firms' involvement in internationalisation and determinants of i,UNSURE,auto:insufficient_evidence,N
1230,"Geographic diversification, product diversification, and firm cash flow volatili",UNSURE,auto:insufficient_evidence,N
1231,No place like home? How EMNCs from hyper turbulent contexts internationalize by ,UNSURE,auto:insufficient_evidence,N
1234,"""One size fits all""? Convergence in international corporate social responsibilit",UNSURE,auto:insufficient_evidence,Y
1235,Testing the self-selection theory in high corruption environments: evidence from,UNSURE,auto:insufficient_evidence,Y
1240,Performance comparison between domestic and international firms in the high-tech,UNSURE,auto:insufficient_evidence,N
1241,Research on Maintenance Method and Upgrade Strategy of Engine Block Production L,UNSURE,auto:insufficient_evidence,Y
1243,Business Groups and Tax Havens,UNSURE,auto:insufficient_evidence,N
1245,Network ties and export propensity of Vietnamese small and medium enterprises,UNSURE,auto:insufficient_evidence,N
1246,Post-M&A technological capability-building of emerging market firms in China: th,UNSURE,auto:insufficient_evidence,N
1249,Internationalization and longevity of Korean SMEs: the moderating role of contin,UNSURE,auto:insufficient_evidence,N
1251,BUSINESS GROUPS RECONSIDERED: BEYOND PARAGONS AND PARASITES,UNSURE,auto:insufficient_evidence,Y
1253,"Determinants of Firms' Initial Decision to Invest Abroad: An Application of ""Sur",UNSURE,auto:insufficient_evidence,N
1254,Gamification approaches to the early stage of innovation,UNSURE,auto:insufficient_evidence,Y
1257,Explaining the effect of rapid internationalization on horizontal foreign divest,UNSURE,auto:insufficient_evidence,N
1259,When are emerging market multinationals more risk taking?,UNSURE,auto:insufficient_evidence,Y
1261,The Differential Effects of Minority State Ownership Types on the Internationali,UNSURE,auto:insufficient_evidence,N
1264,The antecedents of early internationalization: A configurational perspective,UNSURE,auto:insufficient_evidence,N
1267,Product innovation by supplying domestic and foreign markets,UNSURE,auto:insufficient_evidence,N
1268,Multinational Enterprises and Economic Development in Host Countries: What We Kn,UNSURE,auto:insufficient_evidence,N
1270,Internationalization and corporate social responsibility in the restaurant indus,UNSURE,auto:insufficient_evidence,Y
1271,"Growth, profits and foreign ownership in the Brazilian banking industry",UNSURE,auto:insufficient_evidence,N
1273,International work experience and compensation: Is more always better for CFOs?,UNSURE,auto:insufficient_evidence,N
1274,A STUDY OF THE VALUE OF ICT IN IMPROVING CORPORATE PERFORMANCE: A CORPORATE COMP,UNSURE,auto:insufficient_evidence,Y
1276,The dual impact of 'excellent' research on science and innovation: the case of E,UNSURE,auto:insufficient_evidence,N
1277,Intramural and external R&D: evidence for complementarity or substitutability,UNSURE,auto:insufficient_evidence,N
1278,Foreign participation and internationalization intensity of African enterprises,UNSURE,auto:insufficient_evidence,Y
1279,Organizational performance feedback effects and international expansion,UNSURE,auto:insufficient_evidence,N
1281,Venture capital: The effect of local and global social ties on firm performance,UNSURE,auto:insufficient_evidence,N
1282,Diplomatic and corporate networks: Bridges to foreign locations,UNSURE,auto:insufficient_evidence,N
1285,Fostering place-based innovation and internationalization - the new turn in Germ,UNSURE,auto:insufficient_evidence,Y
1286,Are SMEs with immigrant owners exceptional exporters?,UNSURE,auto:insufficient_evidence,N
1287,Board Gender Diversity in the STEM&F Sectors: The Critical Mass Required to Driv,Y,"auto_abstract:quantitative_stat,ip_performance",Y
1289,Innovativeness as a driver of the international expansion of developing markets',UNSURE,auto:insufficient_evidence,N
1290,Family ownership and family involvement as antecedents of strategic action: A lo,UNSURE,auto:insufficient_evidence,N
1291,Diffusion of internationalization in business group networks: evidence from Indi,UNSURE,auto:insufficient_evidence,Y
1292,Business group reputation and affiliates' internationalization strategies,UNSURE,auto:insufficient_evidence,N
1293,Innovation activities and learning processes in the crisis: evidence from Italia,UNSURE,auto:insufficient_evidence,N
1295,"How ""space"" and ""place"" influence subsidiary host country political embeddedness",UNSURE,auto:insufficient_evidence,N
1296,Domestic alliance networks and regional strategies of MNEs: A structural embedde,UNSURE,auto:insufficient_evidence,N
1297,"Strategic goal accomplishment in export ventures: the role of capabilities, know",UNSURE,auto:insufficient_evidence,N
1300,Top management teams' managerial resources and international diversification The,UNSURE,auto:insufficient_evidence,N
1301,"Internationalization, dynamic environments and new product development An empiri",UNSURE,auto:insufficient_evidence,N
1303,Family entrepreneurship and internationalization strategies,UNSURE,auto:insufficient_evidence,Y
1308,Exploring market orientation among Chinese small and medium-sized enterprises,UNSURE,auto:insufficient_evidence,Y
1311,Internationalization of African-ethnic restaurants: A qualitative enquiry using ,UNSURE,auto:insufficient_evidence,N
1312,Innovation and international business,UNSURE,auto:insufficient_evidence,Y
1313,Attitudes towards women's career advancement in Latin America: The moderating im,UNSURE,auto:insufficient_evidence,N
1315,The Value of Local Externalities in Country-of-Origin Clusters: Evidence from Ch,UNSURE,auto:insufficient_evidence,N
1316,Multinationals and sustainable development: Does internationalization develop co,UNSURE,auto:insufficient_evidence,Y
1317,"Born globals - presence, performance and prospects",UNSURE,auto:insufficient_evidence,N
1319,Internationalization and entrepreneurial orientation of family SMEs: The influen,UNSURE,auto:insufficient_evidence,N
1320,Exploring the Strategic Motivation of Internationalisation: Indonesian Contracto,UNSURE,auto:insufficient_evidence,Y
1321,From new imported inputs to new exported products. Firm-level evidence from Swed,UNSURE,auto:insufficient_evidence,N
1322,Relationship between Corporate Social Responsibility (CSR) and Internationalisat,UNSURE,auto:insufficient_evidence,Y
1323,"A Comparison of Information Technology Capability, Employee Empowerment and Inno",UNSURE,auto:insufficient_evidence,N
1325,Transition in-and-out of exporting and its impact on employment growth,UNSURE,auto:insufficient_evidence,Y
1326,The Role of a Manager's Intangible Capabilities in Resource Acquisition and Sust,UNSURE,auto:insufficient_evidence,N
1327,CSR engagement and values in a pre-emerging and emerging country context,UNSURE,auto:insufficient_evidence,Y
1329,Application of human resource management's universal model: An examination of pe,UNSURE,auto:insufficient_evidence,Y
1331,An institutional response model to economic liberalization: Japanese MNEs' owner,UNSURE,auto:insufficient_evidence,N
1333,Role of resource slack in rapid international expansion of restaurant companies,Y,"auto_abstract:quantitative_method,quantitative_stat",Y
1334,"Ex-post Performance Implications of Divergence of Managers' Perceptions of ""Dist",UNSURE,auto:insufficient_evidence,N
1335,"The CEO as a key microfoundation of global strategy: Task demands, CEO origin, a",UNSURE,auto:insufficient_evidence,Y
1336,Internationalization Orientation in SMEs: The Mediating Role of Technological In,UNSURE,auto:insufficient_evidence,N
1337,An Effectual-Causal View of Managerial Decisions in the Internationalization of ,UNSURE,auto:insufficient_evidence,N
1338,How outside directors' human and social capital create value for corporate inter,UNSURE,auto:insufficient_evidence,N
1342,Gains from multinational competition for cross-border firm acquisition,UNSURE,auto:insufficient_evidence,Y
1343,R&D and patenting activities of foreign firms in China: The case of Japan,UNSURE,auto:insufficient_evidence,N
1344,"When less family is more: Trademark acquisition, family ownership, and internati",UNSURE,auto:insufficient_evidence,N
1345,"Family influences in the internationalization of the top 1,000 Taiwanese enterpr",UNSURE,auto:insufficient_evidence,N
1346,Adapting and sustaining operations in weak institutional environments: A busines,UNSURE,auto:insufficient_evidence,N
1347,Effects of prior market experiences and firm-specific resources on developed eco,UNSURE,auto:insufficient_evidence,N
1348,Pulling the Plug? Investigating Firm-Level Drivers of Innovation Project Termina,UNSURE,auto:insufficient_evidence,N
1349,Competition at home and foreign market entry timing,UNSURE,auto:insufficient_evidence,N
1351,Firm Diversification and Financial Performance: Evidence from Manufacturing Firm,UNSURE,auto:insufficient_evidence,N
1353,"Culture, business environment and SMEs' profitability: Evidence from European Co",UNSURE,auto:insufficient_evidence,N
1354,Organizational creativity as a crucial resource for building international busin,UNSURE,auto:insufficient_evidence,N
1356,THE MEDIATING EFFECT OF HUMAN CAPITAL ON THE RELATIONSHIP BETWEEN STRATEGIC INNO,UNSURE,auto:insufficient_evidence,Y
1360,Corporate social responsibility and competitive advantage: A developing country ,UNSURE,auto:insufficient_evidence,Y
1361,Antecedents of strategic ambidexterity in the context of internationalisation: a,UNSURE,auto:insufficient_evidence,Y
1362,"National institutional systems, foreign ownership and firm performance: The case",UNSURE,auto:insufficient_evidence,N
1365,State Ownership and Political Connections,UNSURE,auto:insufficient_evidence,Y
1366,New director selection during growth in family-influenced and lone founder firms,UNSURE,auto:insufficient_evidence,N
1367,Exploring alternative approaches to entrepreneurial exporting: internationalizat,UNSURE,auto:insufficient_evidence,Y
1370,Measurement scale of international opportunity identification in early internati,UNSURE,auto:insufficient_evidence,Y
1372,"The relationship between public listing, context, multi-nationality and internal",UNSURE,auto:insufficient_evidence,N
1374,Performance in family firm: Influences of socioemotional wealth and managerial c,UNSURE,auto:insufficient_evidence,N
1375,"Debt financing structure, ownership concentration and firm performance: a compar",UNSURE,auto:insufficient_evidence,N
1376,Relocation of second degree: Moving towards a new place or returning home?,UNSURE,auto:insufficient_evidence,N
1377,Determinants of SMEs' performance: evidence from European countries,UNSURE,auto:insufficient_evidence,Y
1379,Some twins are not alike: FDI premia in the former Soviet states,UNSURE,auto:insufficient_evidence,Y
1381,Going home and helping out? Returnees as propagators of CSR in an emerging econo,UNSURE,auto:insufficient_evidence,N
1385,International networking and knowledge acquisition of Chinese SMEs: the role of ,UNSURE,auto:insufficient_evidence,N
1386,"""2R-Based View' on the Internationalization of Service MNEs from Emerging Econom",UNSURE,auto:insufficient_evidence,N
1387,Benefits of IT-Enabled Flexibilities for Foreign versus Local Firms in Emerging ,UNSURE,auto:insufficient_evidence,Y
1388,Disentangling the influence of internationalization on sustainability developmen,UNSURE,auto:insufficient_evidence,N
