priority_rank,seq,year,journal,title,doi,doi_link,google_scholar,icrv,dpl,fp_type,country_guess,pdf_status,source_url_or_pdf_path,pdf_filename,extraction_note,sample_size_n,converted_r,conversion_formula,reported_coefficient,t_value,p_value,effect_direction,model_type,study_period_start,study_period_end,notes_for_extractor,ready_for_r
415,442,2012,RESEARCH IN ECONOMICS,Firms' internationalization and productivity growth,,,https://scholar.google.com/scholar?q=Firms%27%20internationalization%20and%20productivity%20growth,,3,productivity,TO_EXTRACT,NO_PDF,,,NEED_R | NEED_N | NEED_ICRV | FIND_PDF_FIRST,,,If t available: r=sqrt(t^2/(t^2+df)); if r available: use direct; Fisher_z=0.5*ln((1+r)/(1-r)); variance_z=1/(n-3),,,,,,,,doi; sample_size; effect_size; statistic; performance_measure; intl_operationalization; model_type,NO
416,443,2012,INNOVATIONS IN INTERNATIONAL BUSINESS,The Role of Internationalization in Explaining Innovation Performance,,,https://scholar.google.com/scholar?q=The%20Role%20of%20Internationalization%20in%20Explaining%20Innovation%20Performance,,3,,TO_EXTRACT,NO_PDF,,,NEED_R | NEED_N | NEED_ICRV | NEED_FP | FIND_PDF_FIRST,,,If t available: r=sqrt(t^2/(t^2+df)); if r available: use direct; Fisher_z=0.5*ln((1+r)/(1-r)); variance_z=1/(n-3),,,,,,,,doi; sample_size; effect_size; statistic; performance_measure; intl_operationalization; model_type,NO
417,444,2012,APPLIED ECONOMICS,"Export, FDI and firm productivity",,,https://scholar.google.com/scholar?q=Export%2C%20FDI%20and%20firm%20productivity,,3,LAB,TO_EXTRACT,NO_PDF,,,NEED_R | NEED_N | NEED_ICRV | FIND_PDF_FIRST,,,If t available: r=sqrt(t^2/(t^2+df)); if r available: use direct; Fisher_z=0.5*ln((1+r)/(1-r)); variance_z=1/(n-3),,,,,,,,doi; sample_size; effect_size; statistic; performance_measure; intl_operationalization; model_type,NO
418,445,2012,INDUSTRIAL MARKETING MANAGEMENT,The effect of government-designed export promotion service use on small and medium-sized enterprise goal achievement: A multidimensional view of export performance,,,https://scholar.google.com/scholar?q=The%20effect%20of%20government-designed%20export%20promotion%20service%20use%20on%20small%20and%20medium-sized%20enterprise%20goal%20achievement%3A%20A%20multidimensional%20view%20of%20export%20performance,,3,EXP,TO_EXTRACT,NO_PDF,,,NEED_R | NEED_N | NEED_ICRV | FIND_PDF_FIRST,,,If t available: r=sqrt(t^2/(t^2+df)); if r available: use direct; Fisher_z=0.5*ln((1+r)/(1-r)); variance_z=1/(n-3),,,,,,,,doi; sample_size; effect_size; statistic; performance_measure; intl_operationalization; model_type,NO
420,448,2011,ACTUAL PROBLEMS OF ECONOMICS,REEXAMINATION OF THE RELATIONSHIP BETWEEN INTERNATIONALIZATION AND FIRM PERFORMANCE,,,https://scholar.google.com/scholar?q=REEXAMINATION%20OF%20THE%20RELATIONSHIP%20BETWEEN%20INTERNATIONALIZATION%20AND%20FIRM%20PERFORMANCE,,3,composite,TO_EXTRACT,NO_PDF,,,NEED_R | NEED_N | NEED_ICRV | FIND_PDF_FIRST,,,If t available: r=sqrt(t^2/(t^2+df)); if r available: use direct; Fisher_z=0.5*ln((1+r)/(1-r)); variance_z=1/(n-3),,,,,,,,doi; sample_size; effect_size; statistic; performance_measure; intl_operationalization; model_type,NO
422,456,2008,TECHNOVATION,The role of internationalization in explaining innovation performance,,,https://scholar.google.com/scholar?q=The%20role%20of%20internationalization%20in%20explaining%20innovation%20performance,,2,,TO_EXTRACT,NO_PDF,,,NEED_R | NEED_N | NEED_ICRV | NEED_FP | FIND_PDF_FIRST,,,If t available: r=sqrt(t^2/(t^2+df)); if r available: use direct; Fisher_z=0.5*ln((1+r)/(1-r)); variance_z=1/(n-3),,,,,,,,doi; sample_size; effect_size; statistic; performance_measure; intl_operationalization; model_type,NO
423,457,2006,"MULTINATIONAL FIRMS, INNOVATION AND PRODUCTIVITY","How firms differ in innovation, productivity and internationalisation",,,https://scholar.google.com/scholar?q=How%20firms%20differ%20in%20innovation%2C%20productivity%20and%20internationalisation,,2,productivity,TO_EXTRACT,NO_PDF,,,NEED_R | NEED_N | NEED_ICRV | FIND_PDF_FIRST,,,If t available: r=sqrt(t^2/(t^2+df)); if r available: use direct; Fisher_z=0.5*ln((1+r)/(1-r)); variance_z=1/(n-3),,,,,,,,doi; sample_size; effect_size; statistic; performance_measure; intl_operationalization; model_type,NO
424,458,2006,INTERNATIONAL JOURNAL OF ENTREPRENEURIAL BEHAVIOR & RESEARCH,Venture adolescence Internationalization and performance implications of maturation,,,https://scholar.google.com/scholar?q=Venture%20adolescence%20Internationalization%20and%20performance%20implications%20of%20maturation,,2,,TO_EXTRACT,NO_PDF,,,NEED_R | NEED_N | NEED_ICRV | NEED_FP | FIND_PDF_FIRST,,,If t available: r=sqrt(t^2/(t^2+df)); if r available: use direct; Fisher_z=0.5*ln((1+r)/(1-r)); variance_z=1/(n-3),,,,,,,,doi; sample_size; effect_size; statistic; performance_measure; intl_operationalization; model_type,NO
425,498,2024,BUSINESS STRATEGY AND DEVELOPMENT,ESG and firm performance: The effects of foreigners on board and export orientation,,,https://scholar.google.com/scholar?q=ESG%20and%20firm%20performance%3A%20The%20effects%20of%20foreigners%20on%20board%20and%20export%20orientation,,3,composite,TO_EXTRACT,NO_PDF,,,NEED_R | NEED_N | NEED_ICRV | FIND_PDF_FIRST,,,If t available: r=sqrt(t^2/(t^2+df)); if r available: use direct; Fisher_z=0.5*ln((1+r)/(1-r)); variance_z=1/(n-3),,,,,,,,doi; sample_size; effect_size; statistic; performance_measure; intl_operationalization; model_type,NO
429,510,2016,ECONOMICS OF INNOVATION AND NEW TECHNOLOGY,"R&D investments, financing constraints, exporting and productivity",,,https://scholar.google.com/scholar?q=R%26D%20investments%2C%20financing%20constraints%2C%20exporting%20and%20productivity,,3,productivity,TO_EXTRACT,NO_PDF,,,NEED_R | NEED_N | NEED_ICRV | FIND_PDF_FIRST,,,If t available: r=sqrt(t^2/(t^2+df)); if r available: use direct; Fisher_z=0.5*ln((1+r)/(1-r)); variance_z=1/(n-3),,,,,,,,doi; sample_size; effect_size; statistic; performance_measure; intl_operationalization; model_type,NO
430,512,2014,JOURNAL OF INTERNATIONAL MANAGEMENT,"Added Psychic Distance Stimuli and MNE Performance Performance Effects of Added Cultural, Governance, Geographic, and Economic Distance in MNEs' International Expansion",,,https://scholar.google.com/scholar?q=Added%20Psychic%20Distance%20Stimuli%20and%20MNE%20Performance%20Performance%20Effects%20of%20Added%20Cultural%2C%20Governance%2C%20Geographic%2C%20and%20Economic%20Distance%20in%20MNEs%27%20International%20Expansion,,3,composite,TO_EXTRACT,NO_PDF,,,NEED_R | NEED_N | NEED_ICRV | FIND_PDF_FIRST,,,If t available: r=sqrt(t^2/(t^2+df)); if r available: use direct; Fisher_z=0.5*ln((1+r)/(1-r)); variance_z=1/(n-3),,,,,,,,doi; sample_size; effect_size; statistic; performance_measure; intl_operationalization; model_type,NO
432,523,1998,TECHNOLOGICAL FORECASTING AND SOCIAL CHANGE,Analysis of the interaction between regional R&D productivity and the investment strategies of multinational enterprises,,,https://scholar.google.com/scholar?q=Analysis%20of%20the%20interaction%20between%20regional%20R%26D%20productivity%20and%20the%20investment%20strategies%20of%20multinational%20enterprises,,1,productivity,TO_EXTRACT,NO_PDF,,,NEED_R | NEED_N | NEED_ICRV | FIND_PDF_FIRST,,,If t available: r=sqrt(t^2/(t^2+df)); if r available: use direct; Fisher_z=0.5*ln((1+r)/(1-r)); variance_z=1/(n-3),,,,,,,,doi; sample_size; effect_size; statistic; performance_measure; intl_operationalization; model_type,NO
435,506,2019,ECONOMICS BULLETIN,How internationalization affects firms' growth in the MENA region? A quantile regression approach,,,https://scholar.google.com/scholar?q=How%20internationalization%20affects%20firms%27%20growth%20in%20the%20MENA%20region%3F%20A%20quantile%20regression%20approach,,3,GROW,TO_EXTRACT,NO_PDF,,,NEED_R | NEED_N | NEED_ICRV | FIND_PDF_FIRST,,,If t available: r=sqrt(t^2/(t^2+df)); if r available: use direct; Fisher_z=0.5*ln((1+r)/(1-r)); variance_z=1/(n-3),,,,,,,,doi; sample_size; effect_size; statistic; performance_measure; intl_operationalization; model_type,NO
438,538,1996,ACADEMY OF MANAGEMENT JOURNAL,Effects of international diversity and product diversity on the performance of multinational firms,10.2307/256635,https://doi.org/10.2307/256635,https://scholar.google.com/scholar?q=Effects%20of%20international%20diversity%20and%20product%20diversity%20on%20the%20performance%20of%20multinational%20firms,,1,composite,,NO_PDF,,,NEED_R | NEED_N | NEED_ICRV | FIND_PDF_FIRST,,,,,,,,,,,source:multi,0
451,551,2000,JOURNAL OF BUSINESS VENTURING,International corporate entrepreneurship and firm performance: The moderating effect of international environmental hostility,,,https://scholar.google.com/scholar?q=International%20corporate%20entrepreneurship%20and%20firm%20performance%3A%20The%20moderating%20effect%20of%20international%20environmental%20host,,2,composite,,NO_PDF,,,NEED_R | NEED_N | NEED_ICRV | FIND_PDF_FIRST,,,,,,,,,,,source:wos,0
454,554,2001,STRATEGIC MANAGEMENT JOURNAL,The internationalization and performance of SMEs,,,https://scholar.google.com/scholar?q=The%20internationalization%20and%20performance%20of%20SMEs,,2,composite,,NO_PDF,,,NEED_R | NEED_N | NEED_ICRV | FIND_PDF_FIRST,,,,,,,,,,,source:multi,0
456,556,2002,JOURNAL OF INTERNATIONAL BUSINESS STUDIES,Multinationality and firm performance: The moderating role of R&D and marketing capabilities,10.1057/palgrave.jibs.8491006,https://doi.org/10.1057/palgrave.jibs.8491006,https://scholar.google.com/scholar?q=Multinationality%20and%20firm%20performance%3A%20The%20moderating%20role%20of%20R%26D%20and%20marketing%20capabilities,,2,composite,,NO_PDF,,,NEED_R | NEED_N | NEED_ICRV | FIND_PDF_FIRST,,,,,,,,,,,source:multi,0
458,558,2002,IMF STAFF PAPERS,How do large depreciations affect firm performance?,10.2307/3872477,https://doi.org/10.2307/3872477,https://scholar.google.com/scholar?q=How%20do%20large%20depreciations%20affect%20firm%20performance%3F,,2,composite,,NO_PDF,,,NEED_R | NEED_N | NEED_ICRV | FIND_PDF_FIRST,,,,,,,,,,,source:wos,0
461,561,2003,JOURNAL OF INTERNATIONAL BUSINESS STUDIES,A three-stage theory of international expansion: the link between multinationality and performance in the service sector,10.1057/palgrave.jibs.8400003,https://doi.org/10.1057/palgrave.jibs.8400003,https://scholar.google.com/scholar?q=A%20three-stage%20theory%20of%20international%20expansion%3A%20the%20link%20between%20multinationality%20and%20performance%20in%20the%20service%20sector,,2,composite,,NO_PDF,,,NEED_R | NEED_N | NEED_ICRV | FIND_PDF_FIRST,,,,,,,,,,,source:wos,0
467,567,2003,JOURNAL OF INTERNATIONAL BUSINESS STUDIES,The relationship between international diversification and performance in service firms,10.1057/palgrave.jibs.8400036,https://doi.org/10.1057/palgrave.jibs.8400036,https://scholar.google.com/scholar?q=The%20relationship%20between%20international%20diversification%20and%20performance%20in%20service%20firms,,2,composite,,NO_PDF,,,NEED_R | NEED_N | NEED_ICRV | FIND_PDF_FIRST,,,,,,,,,,,source:multi,0
468,568,2003,JOURNAL OF SMALL BUSINESS MANAGEMENT,A resource-based approach to the study of export performance,,,https://scholar.google.com/scholar?q=A%20resource-based%20approach%20to%20the%20study%20of%20export%20performance,,2,composite,,NO_PDF,,,NEED_R | NEED_N | NEED_ICRV | FIND_PDF_FIRST,,,,,,,,,,,source:multi,0
473,573,2004,JOURNAL OF MANAGEMENT,The effects of top management team pay and firm internationalization on MNC performance,10.1016/j.jm.2004.02.001,https://doi.org/10.1016/j.jm.2004.02.001,https://scholar.google.com/scholar?q=The%20effects%20of%20top%20management%20team%20pay%20and%20firm%20internationalization%20on%20MNC%20performance,,2,composite,,NO_PDF,,,NEED_R | NEED_N | NEED_ICRV | FIND_PDF_FIRST,,,,,,,,,,,source:multi,0
475,575,2004,POST-COMMUNIST ECONOMIES,Industrial structure and international competitiveness of post-communist Slovenia,,,https://scholar.google.com/scholar?q=Industrial%20structure%20and%20international%20competitiveness%20of%20post-communist%20Slovenia,,2,productivity,,NO_PDF,,,NEED_R | NEED_N | NEED_ICRV | FIND_PDF_FIRST,,,,,,,,,,,source:multi,0
478,578,2004,ACADEMY OF MANAGEMENT JOURNAL,International diversification and firm performance: The S-CURVE hypothesis,,,https://scholar.google.com/scholar?q=International%20diversification%20and%20firm%20performance%3A%20The%20S-CURVE%20hypothesis,,2,composite,,NO_PDF,,,NEED_R | NEED_N | NEED_ICRV | FIND_PDF_FIRST,,,,,,,,,,,source:multi,0
482,582,2005,MULTINATIONAL BUSINESS REVIEW,"Entrepreneurial Strategic Posture, International Diversifi cation, and Firm Performance",10.1108/1525383x200500003,https://doi.org/10.1108/1525383x200500003,https://scholar.google.com/scholar?q=Entrepreneurial%20Strategic%20Posture%2C%20International%20Diversifi%20cation%2C%20and%20Firm%20Performance,,2,composite,,NO_PDF,,,NEED_R | NEED_N | NEED_ICRV | FIND_PDF_FIRST,,,,,,,,,,,source:wos,0
487,587,2005,INTERNATIONAL BUSINESS REVIEW,Antecedents and performance consequences of international outsourcing,,,https://scholar.google.com/scholar?q=Antecedents%20and%20performance%20consequences%20of%20international%20outsourcing,,2,composite,,NO_PDF,,,NEED_R | NEED_N | NEED_ICRV | FIND_PDF_FIRST,,,,,,,,,,,source:multi,0
491,591,2006,MULTINATIONAL BUSINESS REVIEW,Internationalization and Performance: The S-curve Hypothesis and Product Diversity Effect,,,https://scholar.google.com/scholar?q=Internationalization%20and%20Performance%3A%20The%20S-curve%20Hypothesis%20and%20Product%20Diversity%20Effect,,2,composite,,NO_PDF,,,NEED_R | NEED_N | NEED_ICRV | FIND_PDF_FIRST,,,,,,,,,,,source:wos,0
492,592,2006,JOURNAL OF INTERNATIONAL ENTREPRENEURSHIP,SME internationalization and performance: Growth vs. profitability,,,https://scholar.google.com/scholar?q=SME%20internationalization%20and%20performance%3A%20Growth%20vs.%20profitability,,2,composite,,NO_PDF,,,NEED_R | NEED_N | NEED_ICRV | FIND_PDF_FIRST,,,,,,,,,,,source:multi,0
493,593,2006,REVIEW OF WORLD ECONOMICS,Export intensity and plant characteristics: What can we learn from quantile regression?,10.1142/9781786349699_0008,https://doi.org/10.1142/9781786349699_0008,https://scholar.google.com/scholar?q=Export%20intensity%20and%20plant%20characteristics%3A%20What%20can%20we%20learn%20from%20quantile%20regression%3F,,2,,,NO_PDF,,,NEED_R | NEED_N | NEED_ICRV | NEED_FP | FIND_PDF_FIRST,,,,,,,,,,,source:wos,0
503,603,2007,EUROPEAN JOURNAL OF MARKETING,"A review of the foundation, international marketing strategies, and performance of international new ventures",10.1108/03090560710821242,https://doi.org/10.1108/03090560710821242,https://scholar.google.com/scholar?q=A%20review%20of%20the%20foundation%2C%20international%20marketing%20strategies%2C%20and%20performance%20of%20international%20new%20ventures,,2,composite,,NO_PDF,,,NEED_R | NEED_N | NEED_ICRV | FIND_PDF_FIRST,,,,,,,,,,,source:multi,0
505,605,2007,REGIONAL ASPECTS OF MULTINATIONALITY AND PERFORMANCE,PERFORMANCE EFFECTS OF INTERNATIONALIZATION STRATEGIES: A META-ANALYSIS,,,https://scholar.google.com/scholar?q=PERFORMANCE%20EFFECTS%20OF%20INTERNATIONALIZATION%20STRATEGIES%3A%20A%20META-ANALYSIS,,2,composite,,NO_PDF,,,NEED_R | NEED_N | NEED_ICRV | FIND_PDF_FIRST,,,,,,,,,,,source:wos,0
509,609,2007,REGIONAL ASPECTS OF MULTINATIONALITY AND PERFORMANCE,INTRA-REGIONAL SALES AND THE INTERNATIONALIZATION AND PERFORMANCE RELATIONSHIP,,,https://scholar.google.com/scholar?q=INTRA-REGIONAL%20SALES%20AND%20THE%20INTERNATIONALIZATION%20AND%20PERFORMANCE%20RELATIONSHIP,,2,composite,,NO_PDF,,,NEED_R | NEED_N | NEED_ICRV | FIND_PDF_FIRST,,,,,,,,,,,source:wos,0
512,612,2007,JOURNAL OF WORLD BUSINESS,The effect of product diversification strategies on the relationship between international diversification and firm performance,10.1016/j.jwb.2006.11.002,https://doi.org/10.1016/j.jwb.2006.11.002,https://scholar.google.com/scholar?q=The%20effect%20of%20product%20diversification%20strategies%20on%20the%20relationship%20between%20international%20diversification%20and%20firm%20perf,,2,composite,,NO_PDF,,,NEED_R | NEED_N | NEED_ICRV | FIND_PDF_FIRST,,,,,,,,,,,source:wos,0
516,616,2007,JOURNAL OF WORLD BUSINESS,International diversification and firm performance: Role of information technology investments,10.1016/j.jwb.2007.02.004,https://doi.org/10.1016/j.jwb.2007.02.004,https://scholar.google.com/scholar?q=International%20diversification%20and%20firm%20performance%3A%20Role%20of%20information%20technology%20investments,,2,composite,,NO_PDF,,,NEED_R | NEED_N | NEED_ICRV | FIND_PDF_FIRST,,,,,,,,,,,source:wos,0
517,617,2007,INTERNATIONAL BUSINESS REVIEW,The impact of national culture and communication on exporter-distributor relations and on export performance,10.1016/j.ibusrev.2007.01.008,https://doi.org/10.1016/j.ibusrev.2007.01.008,https://scholar.google.com/scholar?q=The%20impact%20of%20national%20culture%20and%20communication%20on%20exporter-distributor%20relations%20and%20on%20export%20performance,,2,composite,,NO_PDF,,,NEED_R | NEED_N | NEED_ICRV | FIND_PDF_FIRST,,,,,,,,,,,source:wos,0
529,629,2008,CANADIAN JOURNAL OF ECONOMICS-REVUE CANADIENNE D ECONOMIQUE,Overseas business costs and firm export performance,10.1111/j.1540-5982.2008.00480.x,https://doi.org/10.1111/j.1540-5982.2008.00480.x,https://scholar.google.com/scholar?q=Overseas%20business%20costs%20and%20firm%20export%20performance,,2,composite,,NO_PDF,,,NEED_R | NEED_N | NEED_ICRV | FIND_PDF_FIRST,,,,,,,,,,,source:wos,0
530,630,2008,SMALL BUSINESS ECONOMICS,The export intensity of venture capital backed companies,10.1007/s11187-008-9109-y,https://doi.org/10.1007/s11187-008-9109-y,https://scholar.google.com/scholar?q=The%20export%20intensity%20of%20venture%20capital%20backed%20companies,,2,,,NO_PDF,,,NEED_R | NEED_N | NEED_ICRV | NEED_FP | FIND_PDF_FIRST,,,,,,,,,,,source:wos,0
538,638,2008,JOURNAL OF WORLD BUSINESS,Internationalization and performance of small- and medium-sized enterprises,10.1016/j.jwb.2007.11.009,https://doi.org/10.1016/j.jwb.2007.11.009,https://scholar.google.com/scholar?q=Internationalization%20and%20performance%20of%20small-%20and%20medium-sized%20enterprises,,2,composite,,NO_PDF,,,NEED_R | NEED_N | NEED_ICRV | FIND_PDF_FIRST,,,,,,,,,,,source:multi,0
540,640,2008,INTERNATIONAL BUSINESS REVIEW,International diversification and performance: The mediating role of implementation,,,https://scholar.google.com/scholar?q=International%20diversification%20and%20performance%3A%20The%20mediating%20role%20of%20implementation,,2,composite,,NO_PDF,,,NEED_R | NEED_N | NEED_ICRV | FIND_PDF_FIRST,,,,,,,,,,,source:multi,0
541,641,2008,CHILEAN JOURNAL OF AGRICULTURAL RESEARCH,EXPORT BEHAVIOUR IN THE CHILEAN AGRIBUSINESS AND FOOD PROCESSING INDUSTRY,,,https://scholar.google.com/scholar?q=EXPORT%20BEHAVIOUR%20IN%20THE%20CHILEAN%20AGRIBUSINESS%20AND%20FOOD%20PROCESSING%20INDUSTRY,,2,,,NO_PDF,,,NEED_R | NEED_N | NEED_ICRV | NEED_FP | FIND_PDF_FIRST,,,,,,,,,,,source:wos,0
555,655,2009,SCANDINAVIAN JOURNAL OF ECONOMICS,Learning-by-Exporting Revisited: The Role of Intensity and Persistence*,,,https://scholar.google.com/scholar?q=Learning-by-Exporting%20Revisited%3A%20The%20Role%20of%20Intensity%20and%20Persistence%2A,,2,,,NO_PDF,,,NEED_R | NEED_N | NEED_ICRV | NEED_FP | FIND_PDF_FIRST,,,,,,,,,,,source:multi,0
584,684,2010,"PAST, PRESENT AND FUTURE OF INTERNATIONAL BUSINESS AND MANAGEMENT",A MULTILEVEL APPROACH TO UNDERSTANDING THE MULTINATIONALITY-PERFORMANCE RELATIONSHIP,,,https://scholar.google.com/scholar?q=A%20MULTILEVEL%20APPROACH%20TO%20UNDERSTANDING%20THE%20MULTINATIONALITY-PERFORMANCE%20RELATIONSHIP,,3,composite,,NO_PDF,,,NEED_R | NEED_N | NEED_ICRV | FIND_PDF_FIRST,,,,,,,,,,,source:wos,0
592,692,2010,MANAGEMENT INTERNATIONAL REVIEW,Top Management Team Internationalization and Firm Performance,,,https://scholar.google.com/scholar?q=Top%20Management%20Team%20Internationalization%20and%20Firm%20Performance,,3,composite,,NO_PDF,,,NEED_R | NEED_N | NEED_ICRV | FIND_PDF_FIRST,,,,,,,,,,,source:multi,0
599,699,2010,STRATEGIC MANAGEMENT JOURNAL,THE PERFORMANCE IMPLICATIONS OF INTRA- AND INTER-REGIONAL GEOGRAPHIC DIVERSIFICATION,,,https://scholar.google.com/scholar?q=THE%20PERFORMANCE%20IMPLICATIONS%20OF%20INTRA-%20AND%20INTER-REGIONAL%20GEOGRAPHIC%20DIVERSIFICATION,,3,composite,,NO_PDF,,,NEED_R | NEED_N | NEED_ICRV | FIND_PDF_FIRST,,,,,,,,,,,source:wos,0
601,701,2010,INDUSTRIAL MARKETING MANAGEMENT,"Internationalization, resource allocation and firm performance",,,https://scholar.google.com/scholar?q=Internationalization%2C%20resource%20allocation%20and%20firm%20performance,,3,composite,,NO_PDF,,,NEED_R | NEED_N | NEED_ICRV | FIND_PDF_FIRST,,,,,,,,,,,source:multi,0
607,707,2010,BRITISH JOURNAL OF MANAGEMENT,"Knowledge Management and Balanced Scorecard Outcomes: Exploring the Importance of Interpretation, Learning and Internationality",10.1111/j.1467-8551.2009.00634.x,https://doi.org/10.1111/j.1467-8551.2009.00634.x,https://scholar.google.com/scholar?q=Knowledge%20Management%20and%20Balanced%20Scorecard%20Outcomes%3A%20Exploring%20the%20Importance%20of%20Interpretation%2C%20Learning%20and%20Internati,,3,composite,,NO_PDF,,,NEED_R | NEED_N | NEED_ICRV | FIND_PDF_FIRST,,,,,,,,,,,source:multi,0
612,712,2011,EUROPEAN BUSINESS REVIEW,Does market context impact payoffs to internationalization?,10.1108/09555341111158100,https://doi.org/10.1108/09555341111158100,https://scholar.google.com/scholar?q=Does%20market%20context%20impact%20payoffs%20to%20internationalization%3F,,3,composite,,NO_PDF,,,NEED_R | NEED_N | NEED_ICRV | FIND_PDF_FIRST,,,,,,,,,,,source:multi,0
614,714,2011,EUROMED JOURNAL OF BUSINESS,Is there new evidence to show that product and international diversification influence SMEs' performance?,,,https://scholar.google.com/scholar?q=Is%20there%20new%20evidence%20to%20show%20that%20product%20and%20international%20diversification%20influence%20SMEs%27%20performance%3F,,3,composite,,NO_PDF,,,NEED_R | NEED_N | NEED_ICRV | FIND_PDF_FIRST,,,,,,,,,,,source:wos,0
618,718,2011,PRELUDES TO THE ICELANDIC FINANCIAL CRISIS,The Internationalization of Iceland's Financial Sector,,,https://scholar.google.com/scholar?q=The%20Internationalization%20of%20Iceland%27s%20Financial%20Sector,,3,,,NO_PDF,,,NEED_R | NEED_N | NEED_ICRV | NEED_FP | FIND_PDF_FIRST,,,,,,,,,,,source:wos,0
621,721,2011,INTERNATIONAL FORESTRY REVIEW,Internationalization and financial performance in the global forest industry,,,https://scholar.google.com/scholar?q=Internationalization%20and%20financial%20performance%20in%20the%20global%20forest%20industry,,3,composite,,NO_PDF,,,NEED_R | NEED_N | NEED_ICRV | FIND_PDF_FIRST,,,,,,,,,,,source:multi,0
639,739,2011,GLOBAL STRATEGY JOURNAL,THE RELATIONSHIP BETWEEN INTERNATIONAL DIVERSIFICATION AND FIRM PERFORMANCE: WHY IT REMAINS A PUZZLE,10.1002/gsj.5,https://doi.org/10.1002/gsj.5,https://scholar.google.com/scholar?q=THE%20RELATIONSHIP%20BETWEEN%20INTERNATIONAL%20DIVERSIFICATION%20AND%20FIRM%20PERFORMANCE%3A%20WHY%20IT%20REMAINS%20A%20PUZZLE,,3,composite,,NO_PDF,,,NEED_R | NEED_N | NEED_ICRV | FIND_PDF_FIRST,,,,,,,,,,,source:wos,0
655,755,2011,EUROPEAN JOURNAL OF MARKETING,Country and firm level factors in international retail expansion,,,https://scholar.google.com/scholar?q=Country%20and%20firm%20level%20factors%20in%20international%20retail%20expansion,,,,,NO_PDF,,,NEED_R | NEED_N | NEED_ICRV | NEED_FP | FIND_PDF_FIRST,,,,,,,,,,,source:multi,
665,765,2012,MANAGEMENT INTERNATIONAL REVIEW,Multinationality-Performance Relationship A Meta-analysis,,,https://scholar.google.com/scholar?q=Multinationality-Performance%20Relationship%20A%20Meta-analysis,,3,composite,,NO_PDF,,,NEED_R | NEED_N | NEED_ICRV | FIND_PDF_FIRST,,,,,,,,,,,source:multi,0
667,767,2011,AFRICAN JOURNAL OF BUSINESS MANAGEMENT,Perceived benefits and barriers to export involvement: Insights from non-exporters,,,https://scholar.google.com/scholar?q=Perceived%20benefits%20and%20barriers%20to%20export%20involvement%3A%20Insights%20from%20non-exporters,,3,,,NO_PDF,,,NEED_R | NEED_N | NEED_ICRV | NEED_FP | FIND_PDF_FIRST,,,,,,,,,,,source:wos,0
674,774,2012,JOURNAL OF INTERNATIONAL ENTREPRENEURSHIP,The impact of geographic diversification on export performance of small and medium-sized enterprises (SMEs),,,https://scholar.google.com/scholar?q=The%20impact%20of%20geographic%20diversification%20on%20export%20performance%20of%20small%20and%20medium-sized%20enterprises%20%28SMEs%29,,3,composite,,NO_PDF,,,NEED_R | NEED_N | NEED_ICRV | FIND_PDF_FIRST,,,,,,,,,,,source:wos,0
676,776,2012,JOURNAL OF MANAGEMENT & ORGANIZATION,"Successor characteristics, change in the degree of firm internationalization, and firm performance: The moderating role of environmental uncertainty",10.5172/jmo.2012.18.1.16,https://doi.org/10.5172/jmo.2012.18.1.16,https://scholar.google.com/scholar?q=Successor%20characteristics%2C%20change%20in%20the%20degree%20of%20firm%20internationalization%2C%20and%20firm%20performance%3A%20The%20moderating%20role%20,,3,composite,,NO_PDF,,,NEED_R | NEED_N | NEED_ICRV | FIND_PDF_FIRST,,,,,,,,,,,source:multi,0
680,780,2012,GLOBAL STRATEGY JOURNAL,THE ROLE OF TERRITORIAL COVERAGE AND PRODUCT DIVERSIFICATION IN THE MULTINATIONALITY-PERFORMANCE RELATIONSHIP,10.1002/gsj.1031,https://doi.org/10.1002/gsj.1031,https://scholar.google.com/scholar?q=THE%20ROLE%20OF%20TERRITORIAL%20COVERAGE%20AND%20PRODUCT%20DIVERSIFICATION%20IN%20THE%20MULTINATIONALITY-PERFORMANCE%20RELATIONSHIP,,3,composite,,NO_PDF,,,NEED_R | NEED_N | NEED_ICRV | FIND_PDF_FIRST,,,,,,,,,,,source:wos,0
681,781,2012,GLOBAL STRATEGY JOURNAL,THE ROLE OF CONTEXT IN THE MULTINATIONALITY-PERFORMANCE RELATIONSHIP: A META-ANALYTIC REVIEW,,,https://scholar.google.com/scholar?q=THE%20ROLE%20OF%20CONTEXT%20IN%20THE%20MULTINATIONALITY-PERFORMANCE%20RELATIONSHIP%3A%20A%20META-ANALYTIC%20REVIEW,,3,composite,,NO_PDF,,,NEED_R | NEED_N | NEED_ICRV | FIND_PDF_FIRST,,,,,,,,,,,source:wos,0
