priority_rank,seq,year,journal,title,doi,doi_link,google_scholar,icrv,dpl,fp_type,country_guess,pdf_status,source_url_or_pdf_path,pdf_filename,extraction_note,sample_size_n,converted_r,conversion_formula,reported_coefficient,t_value,p_value,effect_direction,model_type,study_period_start,study_period_end,notes_for_extractor,ready_for_r
1782,1882,2023,JOURNAL OF INTERNATIONAL MANAGEMENT,Unpacking the relationship between post-entry speed of internationalization and export performance of SMEs: A capability-building perspective,10.1016/j.intman.2022.100982,https://doi.org/10.1016/j.intman.2022.100982,https://scholar.google.com/scholar?q=Unpacking%20the%20relationship%20between%20post-entry%20speed%20of%20internationalization%20and%20export%20performance%20of%20SMEs%3A%20A%20capability,,3,composite,,REPO_URL,https://doi.org/10.1016/j.intman.2022.100982,,NEED_R | NEED_N | NEED_ICRV,,,,,,,,,,,source:wos,0
1835,1935,2023,INTERNATIONAL BUSINESS REVIEW,"Digitalization, internationalization, and firm performance: A resource-orchestration perspective on new OLI advantages",10.1016/j.ibusrev.2023.102135,https://doi.org/10.1016/j.ibusrev.2023.102135,https://scholar.google.com/scholar?q=Digitalization%2C%20internationalization%2C%20and%20firm%20performance%3A%20A%20resource-orchestration%20perspective%20on%20new%20OLI%20advantages,,3,composite,,REPO_URL,https://doi.org/10.1016/j.ibusrev.2023.102135,,NEED_R | NEED_N | NEED_ICRV,,,,,,,,,,,source:multi,0
1864,1964,2024,JOURNAL OF WORLD BUSINESS,The interplay of international alliance and subsidiary portfolios: Implications for firms' innovation and financial performance,10.1016/j.jwb.2023.101500,https://doi.org/10.1016/j.jwb.2023.101500,https://scholar.google.com/scholar?q=The%20interplay%20of%20international%20alliance%20and%20subsidiary%20portfolios%3A%20Implications%20for%20firms%27%20innovation%20and%20financial%20perf,,3,composite,,REPO_URL,https://www.sciencedirect.com/science/article/am/pii/S1090951623000755,,NEED_R | NEED_N | NEED_ICRV,,,,,,,,,,,source:multi,0
1866,1966,2023,ACADEMIA-REVISTA LATINOAMERICANA DE ADMINISTRACION,"Firm certification and export performance: the case of the ""SME Leader"" label",10.1108/arla-05-2023-0073,https://doi.org/10.1108/arla-05-2023-0073,https://scholar.google.com/scholar?q=Firm%20certification%20and%20export%20performance%3A%20the%20case%20of%20the%20%22SME%20Leader%22%20label,,3,composite,,REPO_URL,https://hdl.handle.net/11328/5197,,NEED_R | NEED_N | NEED_ICRV,,,,,,,,,,,source:wos,0
1882,1982,2023,HELIYON,A clean road to international trade: Environmental regulations and the cleanliness of export enterprises,10.2139/ssrn.4484472,https://doi.org/10.2139/ssrn.4484472,https://scholar.google.com/scholar?q=A%20clean%20road%20to%20international%20trade%3A%20Environmental%20regulations%20and%20the%20cleanliness%20of%20export%20enterprises,,3,,,REPO_URL,http://dx.doi.org/10.2139/ssrn.4484472,,NEED_R | NEED_N | NEED_ICRV | NEED_FP,,,,,,,,,,,source:wos,0
1956,2056,2024,JOURNAL OF INTERNATIONAL MANAGEMENT,The impact of liability of foreignness on performance in hybrid organizations,10.1016/j.intman.2024.101133,https://doi.org/10.1016/j.intman.2024.101133,https://scholar.google.com/scholar?q=The%20impact%20of%20liability%20of%20foreignness%20on%20performance%20in%20hybrid%20organizations,,3,composite,,REPO_URL,https://doi.org/10.1016/j.intman.2024.101133,,NEED_R | NEED_N | NEED_ICRV,,,,,,,,,,,source:wos,0
2044,2144,2025,TECHNOLOGICAL FORECASTING AND SOCIAL CHANGE,"What drives SME export intensity in transition economies? The role of infrastructure, digitalisation and innovation capabilities",10.1016/j.techfore.2025.124123,https://doi.org/10.1016/j.techfore.2025.124123,https://scholar.google.com/scholar?q=What%20drives%20SME%20export%20intensity%20in%20transition%20economies%3F%20The%20role%20of%20infrastructure%2C%20digitalisation%20and%20innovation%20capa,,3,,,REPO_URL,https://doi.org/10.1016/j.techfore.2025.124123,,NEED_R | NEED_N | NEED_ICRV | NEED_FP,,,,,,,,,,,source:multi,0
2085,2185,2025,JOURNAL OF PRODUCT INNOVATION MANAGEMENT,Old but Sold? Innovation Through Tradition Strategy for Export and the Role of Family Involvement,10.1111/jpim.12796,https://doi.org/10.1111/jpim.12796,https://scholar.google.com/scholar?q=Old%20but%20Sold%3F%20Innovation%20Through%20Tradition%20Strategy%20for%20Export%20and%20the%20Role%20of%20Family%20Involvement,,3,composite,,REPO_URL,https://doi.org/10.1111/jpim.12796,,NEED_R | NEED_N | NEED_ICRV,,,,,,,,,,,source:wos,0
2149,2249,2026,JOURNAL OF INTERNATIONAL MARKETING,Juggling Markets and Products: How Does Ambidexterity Impact Export Performance?,10.1177/1069031x251408340,https://doi.org/10.1177/1069031x251408340,https://scholar.google.com/scholar?q=Juggling%20Markets%20and%20Products%3A%20How%20Does%20Ambidexterity%20Impact%20Export%20Performance%3F,,3,composite,,REPO_URL,https://doi.org/10.1177/1069031x251408340,,NEED_R | NEED_N | NEED_ICRV,,,,,,,,,,,source:wos,0
2191,2291,2025,Journal of Open Innovation Technology Market and Complexity,"Export promotion programs and firm performance: Linking knowledge, commitment, and market strategy to enhance competitiveness",10.1016/j.joitmc.2025.100479,https://doi.org/10.1016/j.joitmc.2025.100479,https://scholar.google.com/scholar?q=Export%20promotion%20programs%20and%20firm%20performance%3A%20Linking%20knowledge%2C%20commitment%2C%20and%20market%20strategy%20to%20enhance%20competitiv,,3,composite,,REPO_URL,https://doi.org/10.1016/j.joitmc.2025.100479,,NEED_R | NEED_N | NEED_ICRV,,,,,,,,,,,source:scopus,0
2197,2297,2024,Heliyon,Industry clusters and firm performance: Evidence from the leather product industry in Addis Ababa,10.1016/j.heliyon.2024.e39486,https://doi.org/10.1016/j.heliyon.2024.e39486,https://scholar.google.com/scholar?q=Industry%20clusters%20and%20firm%20performance%3A%20Evidence%20from%20the%20leather%20product%20industry%20in%20Addis%20Ababa,,3,composite,,REPO_URL,https://doi.org/10.1016/j.heliyon.2024.e39486,,NEED_R | NEED_N | NEED_ICRV,,,,,,,,sem,,,source:scopus,0
2244,2344,2021,Journal of Business Economics,Commitment to exporting as an antecedent of organizational skills and firm performance,10.1007/s11573-021-01028-x,https://doi.org/10.1007/s11573-021-01028-x,https://scholar.google.com/scholar?q=Commitment%20to%20exporting%20as%20an%20antecedent%20of%20organizational%20skills%20and%20firm%20performance,,3,composite,,REPO_URL,http://hdl.handle.net/10198/23835,,NEED_R | NEED_N | NEED_ICRV,,,,,,,,,,,source:scopus,0
2305,2405,2017,International Journal of Wine Business Research,Internationalization vs family ownership and management: the case of Portuguese wine firms,10.1108/ijwbr-10-2016-0034,https://doi.org/10.1108/ijwbr-10-2016-0034,https://scholar.google.com/scholar?q=Internationalization%20vs%20family%20ownership%20and%20management%3A%20the%20case%20of%20Portuguese%20wine%20firms,,3,composite,,REPO_URL,http://hdl.handle.net/11328/1852,,NEED_R | NEED_N | NEED_ICRV,,,,,,,,panel,,,source:scopus,0
2344,2444,2013,Journal of Hospitality Financial Management,Financial performance and internationalization in the U.S. restaurant industry: A simultaneous perspective and analysis,10.1080/10913211.2013.861229,https://doi.org/10.1080/10913211.2013.861229,https://scholar.google.com/scholar?q=Financial%20performance%20and%20internationalization%20in%20the%20U.S.%20restaurant%20industry%3A%20A%20simultaneous%20perspective%20and%20analysis,,3,composite,,REPO_URL,https://stars.library.ucf.edu/ucfscholar/333,,NEED_R | NEED_N | NEED_ICRV,,,,,,,,,,,source:scopus,0
2362,2462,2011,International Journal on Food System Dynamics,Internationalization and Firm Performance in Agribusiness: Empirical Evidence from European Cooperatives,10.18461/ijfsd.v2i1.216,https://doi.org/10.18461/ijfsd.v2i1.216,https://scholar.google.com/scholar?q=Internationalization%20and%20Firm%20Performance%20in%20Agribusiness%3A%20Empirical%20Evidence%20from%20European%20Cooperatives,,3,composite,,REPO_URL,https://doi.org/10.18461/ijfsd.v2i1.216,,NEED_R | NEED_N | NEED_ICRV,,,,,,,,,,,source:scopus,0
2387,2487,2008,Organization Science,Alliance portfolio internationalization and firm performance,10.1287/orsc.1070.0341,https://doi.org/10.1287/orsc.1070.0341,https://scholar.google.com/scholar?q=Alliance%20portfolio%20internationalization%20and%20firm%20performance,,2,composite,,REPO_URL,https://papers.ssrn.com/sol3/Delivery.cfm/SSRN_ID1027130_code663947.pdf?abstractid=1027130&mirid=1,,NEED_R | NEED_N | NEED_ICRV,,,,,,,,,,,source:scopus,0
2394,2494,2007,Journal of International Business Studies,Internationalization and the performance of born-global SMEs: The mediating role of social networks,10.1057/palgrave.jibs.8400282,https://doi.org/10.1057/palgrave.jibs.8400282,https://scholar.google.com/scholar?q=Internationalization%20and%20the%20performance%20of%20born-global%20SMEs%3A%20The%20mediating%20role%20of%20social%20networks,,2,composite,,REPO_URL,https://papers.ssrn.com/sol3/Delivery.cfm/SSRN_ID2260506_code1051326.pdf?abstractid=2260506&mirid=3,,NEED_R | NEED_N | NEED_ICRV,,,,,,,,,,,source:scopus,0
2414,2514,2004,Journal of Economic Surveys,How domestic and foreign firms differ and why does it matter?,10.1111/j.0950-0804.2004.00228.x,https://doi.org/10.1111/j.0950-0804.2004.00228.x,https://scholar.google.com/scholar?q=How%20domestic%20and%20foreign%20firms%20differ%20and%20why%20does%20it%20matter%3F,,2,composite,,REPO_URL,https://research.wu.ac.at/files/18958642/document.pdf,,NEED_R | NEED_N | NEED_ICRV,,,,,,,,,,,source:scopus,0
2422,2522,2003,Journal of Small Business and Enterprise Development,Company performance and objectives reported by first and multi-generation family companies: A research note,10.1108/14626000310461231,https://doi.org/10.1108/14626000310461231,https://scholar.google.com/scholar?q=Company%20performance%20and%20objectives%20reported%20by%20first%20and%20multi-generation%20family%20companies%3A%20A%20research%20note,,2,composite,,REPO_URL,https://durham-repository.worktribe.com/output/1562938,,NEED_R | NEED_N | NEED_ICRV,,,,,,,,,,,source:scopus,0
8,116,2013,JOURNAL OF WINE ECONOMICS,"Intangibles, Export Intensity, and Company Performance in the French Wine Industry",10.1017/jwe.2013.27,https://doi.org/10.1017/jwe.2013.27,https://scholar.google.com/scholar?q=Intangibles%2C%20Export%20Intensity%2C%20and%20Company%20Performance%20in%20the%20French%20Wine%20Industry,1,3,,France,NO_PDF,,,NEED_R | NEED_N | NEED_FP | FIND_PDF_FIRST,,,If t available: r=sqrt(t^2/(t^2+df)); if r available: use direct; Fisher_z=0.5*ln((1+r)/(1-r)); variance_z=1/(n-3),,,,,,,,sample_size; effect_size; statistic; performance_measure; intl_operationalization; model_type,NO
15,179,2025,JOURNAL OF RURAL STUDIES,"Internationalization, innovation, and resilience: Financial performance of agricultural cooperatives in southeastern Spain's rural economy",10.1016/j.jrurstud.2025.103682,https://doi.org/10.1016/j.jrurstud.2025.103682,https://scholar.google.com/scholar?q=Internationalization%2C%20innovation%2C%20and%20resilience%3A%20Financial%20performance%20of%20agricultural%20cooperatives%20in%20southeastern%20Spain%27s%20rural%20economy,1,3,composite,Spain,NO_PDF,,,NEED_R | NEED_N | FIND_PDF_FIRST,,,If t available: r=sqrt(t^2/(t^2+df)); if r available: use direct; Fisher_z=0.5*ln((1+r)/(1-r)); variance_z=1/(n-3),,,,,,,,sample_size; effect_size; statistic; performance_measure; intl_operationalization; model_type,NO
39,350,2005,INTERNATIONAL JOURNAL OF TECHNOLOGY MANAGEMENT,The impact of internationalisation and proprietary assets on firm performance: an empirical analysis of Taiwanese high-tech firms,10.1504/ijtm.2005.006007,https://doi.org/10.1504/ijtm.2005.006007,https://scholar.google.com/scholar?q=The%20impact%20of%20internationalisation%20and%20proprietary%20assets%20on%20firm%20performance%3A%20an%20empirical%20analysis%20of%20Taiwanese%20high-tech%20firms,1,2,composite,Taiwan,NO_PDF,,,NEED_R | NEED_N | FIND_PDF_FIRST,,,If t available: r=sqrt(t^2/(t^2+df)); if r available: use direct; Fisher_z=0.5*ln((1+r)/(1-r)); variance_z=1/(n-3),,,,,,,,sample_size; effect_size; statistic; performance_measure; intl_operationalization; model_type,NO
40,351,2005,TELECOMMUNICATIONS POLICY,The degree of internationalization and the financial performance of European mobile network operators,10.1016/j.telpol.2005.06.003,https://doi.org/10.1016/j.telpol.2005.06.003,https://scholar.google.com/scholar?q=The%20degree%20of%20internationalization%20and%20the%20financial%20performance%20of%20European%20mobile%20network%20operators,1,2,composite,Europe,NO_PDF,,,NEED_R | NEED_N | FIND_PDF_FIRST,,,If t available: r=sqrt(t^2/(t^2+df)); if r available: use direct; Fisher_z=0.5*ln((1+r)/(1-r)); variance_z=1/(n-3),,,,,,,,sample_size; effect_size; statistic; performance_measure; intl_operationalization; model_type,NO
41,470,2022,JOURNAL OF INTELLECTUAL CAPITAL,Intellectual capital and firm efficiency of US multinational software firms,10.1108/jic-02-2021-0041,https://doi.org/10.1108/jic-02-2021-0041,https://scholar.google.com/scholar?q=Intellectual%20capital%20and%20firm%20efficiency%20of%20US%20multinational%20software%20firms,1,3,Efficiency,TO_EXTRACT,NO_PDF,,,NEED_R | NEED_N | FIND_PDF_FIRST,,,If t available: r=sqrt(t^2/(t^2+df)); if r available: use direct; Fisher_z=0.5*ln((1+r)/(1-r)); variance_z=1/(n-3),,,,,,,,sample_size; effect_size; statistic; performance_measure; intl_operationalization; model_type,NO
42,473,2021,JOURNAL OF INTERNATIONAL FINANCIAL MANAGEMENT & ACCOUNTING,Exploring nonlinear linkage between profitability and leverage: US multinational versus domestic corporations,10.1111/jifm.12134,https://doi.org/10.1111/jifm.12134,https://scholar.google.com/scholar?q=Exploring%20nonlinear%20linkage%20between%20profitability%20and%20leverage%3A%20US%20multinational%20versus%20domestic%20corporations,1,3,composite,TO_EXTRACT,NO_PDF,,,NEED_R | NEED_N | FIND_PDF_FIRST,,,If t available: r=sqrt(t^2/(t^2+df)); if r available: use direct; Fisher_z=0.5*ln((1+r)/(1-r)); variance_z=1/(n-3),,,,,,,,sample_size; effect_size; statistic; performance_measure; intl_operationalization; model_type,NO
48,494,2009,INTERNATIONAL JOURNAL OF HOSPITALITY MANAGEMENT,Impact of brand recognition and brand reputation on firm performance: US-based multinational restaurant companies' perspective,10.1016/j.ijhm.2009.04.002,https://doi.org/10.1016/j.ijhm.2009.04.002,https://scholar.google.com/scholar?q=Impact%20of%20brand%20recognition%20and%20brand%20reputation%20on%20firm%20performance%3A%20US-based%20multinational%20restaurant%20companies%27%20perspective,1,2,composite,TO_EXTRACT,NO_PDF,,,NEED_R | NEED_N | FIND_PDF_FIRST,,,If t available: r=sqrt(t^2/(t^2+df)); if r available: use direct; Fisher_z=0.5*ln((1+r)/(1-r)); variance_z=1/(n-3),,,,,,,,sample_size; effect_size; statistic; performance_measure; intl_operationalization; model_type,NO
56,46,2021,TRANSNATIONAL CORPORATIONS REVIEW,'Letters to the editor': the relationship between multinationality and firm performance in emerging markets,10.1080/19186444.2020.1857122,https://doi.org/10.1080/19186444.2020.1857122,https://scholar.google.com/scholar?q=%27Letters%20to%20the%20editor%27%3A%20the%20relationship%20between%20multinationality%20and%20firm%20performance%20in%20emerging%20markets,2,3,composite,Emerging markets,NO_PDF,,,NEED_R | NEED_N | FIND_PDF_FIRST,,,If t available: r=sqrt(t^2/(t^2+df)); if r available: use direct; Fisher_z=0.5*ln((1+r)/(1-r)); variance_z=1/(n-3),,,,,,,,sample_size; effect_size; statistic; performance_measure; intl_operationalization; model_type,NO
73,176,2025,SUSTAINABILITY,"Does Maintaining Resources, Diversification, and Internationalization Matter for Achieving High Firm Performance? A Sustainable Competitiveness Strategy for China Taipei Firms",10.3390/su17041576,https://doi.org/10.3390/su17041576,https://scholar.google.com/scholar?q=Does%20Maintaining%20Resources%2C%20Diversification%2C%20and%20Internationalization%20Matter%20for%20Achieving%20High%20Firm%20Performance%3F%20A%20Sustainable%20Competitiveness%20Strategy%20for%20China%20Taipei%20Firms,2,3,composite,China,NO_PDF,,,NEED_R | NEED_N | FIND_PDF_FIRST,,,If t available: r=sqrt(t^2/(t^2+df)); if r available: use direct; Fisher_z=0.5*ln((1+r)/(1-r)); variance_z=1/(n-3),,,,,,,,sample_size; effect_size; statistic; performance_measure; intl_operationalization; model_type,NO
75,182,2025,JOURNAL OF GLOBAL OPERATIONS AND STRATEGIC SOURCING,Effects of internationalization on supply chain agility and business performance of manufacturing firms in Vietnam,10.1108/jgoss-10-2024-0102,https://doi.org/10.1108/jgoss-10-2024-0102,https://scholar.google.com/scholar?q=Effects%20of%20internationalization%20on%20supply%20chain%20agility%20and%20business%20performance%20of%20manufacturing%20firms%20in%20Vietnam,2,3,,Vietnam,NO_PDF,,,NEED_R | NEED_N | NEED_FP | FIND_PDF_FIRST,,,If t available: r=sqrt(t^2/(t^2+df)); if r available: use direct; Fisher_z=0.5*ln((1+r)/(1-r)); variance_z=1/(n-3),,,,,,,,sample_size; effect_size; statistic; performance_measure; intl_operationalization; model_type,NO
85,226,2022,JOURNAL OF INTERNATIONAL MARKETING,Unbundling the Effects of Internationalization on Firm Performance in Emerging Economies: The Moderating Effects of Strategic Resource Decisions,10.1177/1069031x211030686,https://doi.org/10.1177/1069031x211030686,https://scholar.google.com/scholar?q=Unbundling%20the%20Effects%20of%20Internationalization%20on%20Firm%20Performance%20in%20Emerging%20Economies%3A%20The%20Moderating%20Effects%20of%20Strategic%20Resource%20Decisions,2,3,composite,Emerging markets,NO_PDF,,,NEED_R | NEED_N | FIND_PDF_FIRST,,,If t available: r=sqrt(t^2/(t^2+df)); if r available: use direct; Fisher_z=0.5*ln((1+r)/(1-r)); variance_z=1/(n-3),,,,,,,,sample_size; effect_size; statistic; performance_measure; intl_operationalization; model_type,NO
87,234,2022,PLOS ONE,The dual mechanism of social networks on the relationship between internationalization and firm performance: Empirical evidence from china,10.1371/journal.pone.0263674,https://doi.org/10.1371/journal.pone.0263674,https://scholar.google.com/scholar?q=The%20dual%20mechanism%20of%20social%20networks%20on%20the%20relationship%20between%20internationalization%20and%20firm%20performance%3A%20Empirical%20evidence%20from%20china,2,3,composite,China,NO_PDF,,,NEED_R | NEED_N | FIND_PDF_FIRST,,,If t available: r=sqrt(t^2/(t^2+df)); if r available: use direct; Fisher_z=0.5*ln((1+r)/(1-r)); variance_z=1/(n-3),,,,,,,,sample_size; effect_size; statistic; performance_measure; intl_operationalization; model_type,NO
88,247,2021,CHINESE MANAGEMENT STUDIES,Speed of internationalization and firm performance: the moderating role of potential slack and knowledge assets,10.1108/cms-06-2020-0249,https://doi.org/10.1108/cms-06-2020-0249,https://scholar.google.com/scholar?q=Speed%20of%20internationalization%20and%20firm%20performance%3A%20the%20moderating%20role%20of%20potential%20slack%20and%20knowledge%20assets,2,3,composite,China,NO_PDF,,,NEED_R | NEED_N | FIND_PDF_FIRST,,,If t available: r=sqrt(t^2/(t^2+df)); if r available: use direct; Fisher_z=0.5*ln((1+r)/(1-r)); variance_z=1/(n-3),,,,,,,,sample_size; effect_size; statistic; performance_measure; intl_operationalization; model_type,NO
89,252,2020,JOURNAL OF INTERNATIONAL BUSINESS STUDIES,"Chinese multinationals' fast internationalization: Financial performance advantage in one region, disadvantage in another",10.1057/s41267-019-00279-9,https://doi.org/10.1057/s41267-019-00279-9,https://scholar.google.com/scholar?q=Chinese%20multinationals%27%20fast%20internationalization%3A%20Financial%20performance%20advantage%20in%20one%20region%2C%20disadvantage%20in%20another,2,3,composite,China,NO_PDF,,,NEED_R | NEED_N | FIND_PDF_FIRST,,,If t available: r=sqrt(t^2/(t^2+df)); if r available: use direct; Fisher_z=0.5*ln((1+r)/(1-r)); variance_z=1/(n-3),,,,,,,,sample_size; effect_size; statistic; performance_measure; intl_operationalization; model_type,NO
90,253,2020,JOURNAL OF MANAGEMENT IN ENGINEERING,Relationship between Internationalization and Financial Performance: Evidence from ENR-Listed Chinese Firms,10.1061/(asce)me.1943-5479.0000736,https://doi.org/10.1061/(asce)me.1943-5479.0000736,https://scholar.google.com/scholar?q=Relationship%20between%20Internationalization%20and%20Financial%20Performance%3A%20Evidence%20from%20ENR-Listed%20Chinese%20Firms,2,3,composite,China,NO_PDF,,,NEED_R | NEED_N | FIND_PDF_FIRST,,,If t available: r=sqrt(t^2/(t^2+df)); if r available: use direct; Fisher_z=0.5*ln((1+r)/(1-r)); variance_z=1/(n-3),,,,,,,,sample_size; effect_size; statistic; performance_measure; intl_operationalization; model_type,NO
100,303,2016,JOURNAL OF EAST-WEST BUSINESS,"Founding Environment, Inward Internationalization, and Firm Performance: Evidence from Chinese Private Enterprises",10.1080/10669868.2016.1215667,https://doi.org/10.1080/10669868.2016.1215667,https://scholar.google.com/scholar?q=Founding%20Environment%2C%20Inward%20Internationalization%2C%20and%20Firm%20Performance%3A%20Evidence%20from%20Chinese%20Private%20Enterprises,2,3,composite,China,NO_PDF,,,NEED_R | NEED_N | FIND_PDF_FIRST,,,If t available: r=sqrt(t^2/(t^2+df)); if r available: use direct; Fisher_z=0.5*ln((1+r)/(1-r)); variance_z=1/(n-3),,,,,,,,sample_size; effect_size; statistic; performance_measure; intl_operationalization; model_type,NO
107,460,2026,INTERNATIONAL ECONOMIC REVIEW,"Exporting Like China: Productivity, Market Demand, and Labor Frictions",10.1111/iere.70042,https://doi.org/10.1111/iere.70042,https://scholar.google.com/scholar?q=Exporting%20Like%20China%3A%20Productivity%2C%20Market%20Demand%2C%20and%20Labor%20Frictions,2,3,productivity,China,NO_PDF,,,NEED_R | NEED_N | FIND_PDF_FIRST,,,If t available: r=sqrt(t^2/(t^2+df)); if r available: use direct; Fisher_z=0.5*ln((1+r)/(1-r)); variance_z=1/(n-3),,,,,,,,sample_size; effect_size; statistic; performance_measure; intl_operationalization; model_type,NO
112,480,2018,QUARTERLY REVIEW OF ECONOMICS AND FINANCE,"Exporting, access of foreign technology, and firms' performance: Searching the link in Indian manufacturing",10.1016/j.qref.2017.11.015,https://doi.org/10.1016/j.qref.2017.11.015,https://scholar.google.com/scholar?q=Exporting%2C%20access%20of%20foreign%20technology%2C%20and%20firms%27%20performance%3A%20Searching%20the%20link%20in%20Indian%20manufacturing,2,3,,India,NO_PDF,,,NEED_R | NEED_N | NEED_FP | FIND_PDF_FIRST,,,If t available: r=sqrt(t^2/(t^2+df)); if r available: use direct; Fisher_z=0.5*ln((1+r)/(1-r)); variance_z=1/(n-3),,,,,,,,sample_size; effect_size; statistic; performance_measure; intl_operationalization; model_type,NO
113,484,2015,JOURNAL OF SOUTHEAST ASIAN ECONOMIES,Does Exporting Spur Firm Productivity? Evidence from Vietnam,10.1355/ae32-1e,https://doi.org/10.1355/ae32-1e,https://scholar.google.com/scholar?q=Does%20Exporting%20Spur%20Firm%20Productivity%3F%20Evidence%20from%20Vietnam,2,3,productivity,Vietnam,NO_PDF,,,NEED_R | NEED_N | FIND_PDF_FIRST,,,If t available: r=sqrt(t^2/(t^2+df)); if r available: use direct; Fisher_z=0.5*ln((1+r)/(1-r)); variance_z=1/(n-3),,,,,,,,sample_size; effect_size; statistic; performance_measure; intl_operationalization; model_type,NO
125,123,2012,JOURNAL OF INTERNATIONAL BUSINESS STUDIES,"Export propensity, export intensity and firm performance: The role of the entrepreneurial founding team",10.1057/jibs.2012.16,https://doi.org/10.1057/jibs.2012.16,https://scholar.google.com/scholar?q=Export%20propensity%2C%20export%20intensity%20and%20firm%20performance%3A%20The%20role%20of%20the%20entrepreneurial%20founding%20team,3,3,composite,TO_EXTRACT,NO_PDF,,,NEED_R | NEED_N | FIND_PDF_FIRST,,,If t available: r=sqrt(t^2/(t^2+df)); if r available: use direct; Fisher_z=0.5*ln((1+r)/(1-r)); variance_z=1/(n-3),,,,,,,,sample_size; effect_size; statistic; performance_measure; intl_operationalization; model_type,NO
127,130,2011,THUNDERBIRD INTERNATIONAL BUSINESS REVIEW,Do Export Status and Export Intensity Increase Firm Performance?,10.1002/tie.20386,https://doi.org/10.1002/tie.20386,https://scholar.google.com/scholar?q=Do%20Export%20Status%20and%20Export%20Intensity%20Increase%20Firm%20Performance%3F,3,3,composite,TO_EXTRACT,NO_PDF,,,NEED_R | NEED_N | FIND_PDF_FIRST,,,If t available: r=sqrt(t^2/(t^2+df)); if r available: use direct; Fisher_z=0.5*ln((1+r)/(1-r)); variance_z=1/(n-3),,,,,,,,sample_size; effect_size; statistic; performance_measure; intl_operationalization; model_type,NO
147,324,2013,JOURNAL OF WORLD BUSINESS,Internationalization and firm performance of SMEs: The moderating effects of CEO attributes,10.1016/j.jwb.2012.06.001,https://doi.org/10.1016/j.jwb.2012.06.001,https://scholar.google.com/scholar?q=Internationalization%20and%20firm%20performance%20of%20SMEs%3A%20The%20moderating%20effects%20of%20CEO%20attributes,3,3,composite,TO_EXTRACT,NO_PDF,,,NEED_R | NEED_N | FIND_PDF_FIRST,,,If t available: r=sqrt(t^2/(t^2+df)); if r available: use direct; Fisher_z=0.5*ln((1+r)/(1-r)); variance_z=1/(n-3),,,,,,,,sample_size; effect_size; statistic; performance_measure; intl_operationalization; model_type,NO
158,181,2025,INZINERINE EKONOMIKA-ENGINEERING ECONOMICS,The Impact of Internationalization on Firm Performance of High-Tech Companies in Poland in the Context of Covid-19,10.5755/j01.ee.36.3.31403,https://doi.org/10.5755/j01.ee.36.3.31403,https://scholar.google.com/scholar?q=The%20Impact%20of%20Internationalization%20on%20Firm%20Performance%20of%20High-Tech%20Companies%20in%20Poland%20in%20the%20Context%20of%20Covid-19,3,3,composite,Poland,NO_PDF,,,NEED_R | NEED_N | FIND_PDF_FIRST,,,If t available: r=sqrt(t^2/(t^2+df)); if r available: use direct; Fisher_z=0.5*ln((1+r)/(1-r)); variance_z=1/(n-3),,,,,,,,sample_size; effect_size; statistic; performance_measure; intl_operationalization; model_type,NO
