priority_rank,seq,year,journal,title,doi,doi_link,google_scholar,icrv,dpl,fp_type,country_guess,pdf_status,source_url_or_pdf_path,pdf_filename,extraction_note,sample_size_n,converted_r,conversion_formula,reported_coefficient,t_value,p_value,effect_direction,model_type,study_period_start,study_period_end,notes_for_extractor,ready_for_r
1019,1119,2016,GLOBAL STRATEGY JOURNAL,"CATEGORIZING THE LIABILITY OF FOREIGNNESS: OWNERSHIP, LOCATION, AND INTERNALIZATION-SPECIFIC DIMENSIONS",10.1002/gsj.1140,https://doi.org/10.1002/gsj.1140,https://scholar.google.com/scholar?q=CATEGORIZING%20THE%20LIABILITY%20OF%20FOREIGNNESS%3A%20OWNERSHIP%2C%20LOCATION%2C%20AND%20INTERNALIZATION-SPECIFIC%20DIMENSIONS,2,3,productivity,,NO_PDF,,,NEED_R | NEED_N | FIND_PDF_FIRST,,,,,,,,,,,source:wos,0
1029,1129,2016,MULTINATIONAL BUSINESS REVIEW,Intensity and diversity of internationalization among small and medium-sized exporters in China,10.1108/mbr-08-2015-0037,https://doi.org/10.1108/mbr-08-2015-0037,https://scholar.google.com/scholar?q=Intensity%20and%20diversity%20of%20internationalization%20among%20small%20and%20medium-sized%20exporters%20in%20China,2,3,composite,,NO_PDF,,,NEED_R | NEED_N | FIND_PDF_FIRST,,,,,,,,,,,source:wos,0
1037,1137,2017,MANAGERIAL FINANCE,Working capital management practices in India: survey evidence,,,https://scholar.google.com/scholar?q=Working%20capital%20management%20practices%20in%20India%3A%20survey%20evidence,3,,,,NO_PDF,,,NEED_R | NEED_N | NEED_FP | FIND_PDF_FIRST,,,,,,,,,,,source:multi,
1060,1160,2017,ASIAN BUSINESS & MANAGEMENT,Innovation strategy and export intensity of Chinese SMEs: the moderating role of the home-country business environment,10.1057/s41291-017-0018-2,https://doi.org/10.1057/s41291-017-0018-2,https://scholar.google.com/scholar?q=Innovation%20strategy%20and%20export%20intensity%20of%20Chinese%20SMEs%3A%20the%20moderating%20role%20of%20the%20home-country%20business%20environment,2,3,,,NO_PDF,,,NEED_R | NEED_N | NEED_FP | FIND_PDF_FIRST,,,,,,,,,,,source:wos,0
1066,1166,2016,JOURNAL OF INTERNATIONAL ACCOUNTING RESEARCH,Linking Key Performance Indicators to New International Venture Survival,,,https://scholar.google.com/scholar?q=Linking%20Key%20Performance%20Indicators%20to%20New%20International%20Venture%20Survival,2,3,sales_growth,,NO_PDF,,,NEED_R | NEED_N | FIND_PDF_FIRST,,,,,,,,,,,source:multi,0
1084,1184,2017,REVIEW OF INTERNATIONAL BUSINESS AND STRATEGY,Failure processes of exporting firms: evidence from France,10.1108/ribs-03-2017-0020,https://doi.org/10.1108/ribs-03-2017-0020,https://scholar.google.com/scholar?q=Failure%20processes%20of%20exporting%20firms%3A%20evidence%20from%20France,1,3,composite,,NO_PDF,,,NEED_R | NEED_N | FIND_PDF_FIRST,,,,,,,,,,,source:multi,0
1091,1191,2017,CHALLENGE OF BRIC MULTINATIONALS,NEW FACTS ABOUT BRIC MULTINATIONALS: FROM MACRO TO MICRO EVIDENCE,10.1108/s1745-886220160000011007,https://doi.org/10.1108/s1745-886220160000011007,https://scholar.google.com/scholar?q=NEW%20FACTS%20ABOUT%20BRIC%20MULTINATIONALS%3A%20FROM%20MACRO%20TO%20MICRO%20EVIDENCE,0,3,composite,,NO_PDF,,,NEED_R | NEED_N | FIND_PDF_FIRST,,,,,,,,ols,,,source:wos,0
1106,1206,2017,JOURNAL OF INTERDISCIPLINARY MATHEMATICS,Analysis on the factors of Chinese manufacturing enterprises' direct investment abroad based on Probit model,10.1080/09720502.2017.1382199,https://doi.org/10.1080/09720502.2017.1382199,https://scholar.google.com/scholar?q=Analysis%20on%20the%20factors%20of%20Chinese%20manufacturing%20enterprises%27%20direct%20investment%20abroad%20based%20on%20Probit%20model,2,3,productivity,,NO_PDF,,,NEED_R | NEED_N | FIND_PDF_FIRST,,,,,,,,logit_probit,,,source:multi,0
1111,1211,2018,ASIAN BUSINESS & MANAGEMENT,Internationalization and performance of Korean SMEs: the moderating role of competitive strategy,10.1057/s41291-018-0036-8,https://doi.org/10.1057/s41291-018-0036-8,https://scholar.google.com/scholar?q=Internationalization%20and%20performance%20of%20Korean%20SMEs%3A%20the%20moderating%20role%20of%20competitive%20strategy,1,3,composite,,NO_PDF,,,NEED_R | NEED_N | FIND_PDF_FIRST,,,,,,,,,,,source:wos,0
1133,1233,2018,JOURNAL OF ASIA BUSINESS STUDIES,Does guanxi influence product performance and customer loyalty?,10.1108/jabs-06-2016-0082,https://doi.org/10.1108/jabs-06-2016-0082,https://scholar.google.com/scholar?q=Does%20guanxi%20influence%20product%20performance%20and%20customer%20loyalty%3F,2,3,composite,,NO_PDF,,,NEED_R | NEED_N | FIND_PDF_FIRST,,,,,,,,,,,source:wos,0
1138,1238,2018,JOURNAL OF RESEARCH IN MARKETING AND ENTREPRENEURSHIP,SMEs' marketing performance: the mediating role of market entry capability,10.1108/jrme-03-2016-0005,https://doi.org/10.1108/jrme-03-2016-0005,https://scholar.google.com/scholar?q=SMEs%27%20marketing%20performance%3A%20the%20mediating%20role%20of%20market%20entry%20capability,3,3,composite,,NO_PDF,,,NEED_R | NEED_N | FIND_PDF_FIRST,,,,,,,,sem,,,source:wos,0
1139,1239,2018,EUROPEAN BUSINESS REVIEW,International new ventures and firm performance: evidence from India,10.1108/ebr-07-2016-0099,https://doi.org/10.1108/ebr-07-2016-0099,https://scholar.google.com/scholar?q=International%20new%20ventures%20and%20firm%20performance%3A%20evidence%20from%20India,3,3,composite,,NO_PDF,,,NEED_R | NEED_N | FIND_PDF_FIRST,,,,,,,,,,,source:multi,0
1142,1242,2017,"MANAGEMENT CHALLENGES IN DIFFERENT TYPES OF AFRICAN FIRMS: PROCESSES, PRACTICES AND PERFORMANCE",Export Performance of SMEs in the Rwandan Mining Sector: Challenges and Prospects,10.1007/978-981-10-4536-3_12,https://doi.org/10.1007/978-981-10-4536-3_12,https://scholar.google.com/scholar?q=Export%20Performance%20of%20SMEs%20in%20the%20Rwandan%20Mining%20Sector%3A%20Challenges%20and%20Prospects,6,3,composite,,NO_PDF,,,NEED_R | NEED_N | FIND_PDF_FIRST,,,,,,,,,,,source:wos,0
1155,1255,2018,BUSINESS STRATEGY AND THE ENVIRONMENT,Signaling good by doing good: How does environmental corporate social responsibility affect international expansion?,10.1002/bse.2044,https://doi.org/10.1002/bse.2044,https://scholar.google.com/scholar?q=Signaling%20good%20by%20doing%20good%3A%20How%20does%20environmental%20corporate%20social%20responsibility%20affect%20international%20expansion%3F,2,3,composite,,NO_PDF,,,NEED_R | NEED_N | FIND_PDF_FIRST,,,,,,,,,,,source:wos,0
1180,1280,2018,INTERNATIONAL JOURNAL OF ORGANIZATIONAL ANALYSIS,Corporate diversification and firm performance: an empirical investigation of causality,10.1108/ijoa-04-2017-1149,https://doi.org/10.1108/ijoa-04-2017-1149,https://scholar.google.com/scholar?q=Corporate%20diversification%20and%20firm%20performance%3A%20an%20empirical%20investigation%20of%20causality,3,3,composite,,NO_PDF,,,NEED_R | NEED_N | FIND_PDF_FIRST,,,,,,,,,,,source:multi,0
1194,1294,2018,ENTREPRENEURSHIP THEORY AND PRACTICE,"Slack, Innovation, and Export Intensity: Implications for Small- and Medium-Sized Enterprises",10.1177/1042258718795318,https://doi.org/10.1177/1042258718795318,https://scholar.google.com/scholar?q=Slack%2C%20Innovation%2C%20and%20Export%20Intensity%3A%20Implications%20for%20Small-%20and%20Medium-Sized%20Enterprises,0,3,,,NO_PDF,,,NEED_R | NEED_N | NEED_FP | FIND_PDF_FIRST,,,,,,,,,,,source:wos,0
1199,1299,2017,JOURNAL OF CONTEMPORARY ASIA,Huawei and ZTE in Malaysia: The Localisation of Chinese Transnational Enterprises,10.1080/00472336.2017.1346697,https://doi.org/10.1080/00472336.2017.1346697,https://scholar.google.com/scholar?q=Huawei%20and%20ZTE%20in%20Malaysia%3A%20The%20Localisation%20of%20Chinese%20Transnational%20Enterprises,2,3,composite,,NO_PDF,,,NEED_R | NEED_N | FIND_PDF_FIRST,,,,,,,,,,,source:multi,0
1204,1304,2017,CHINESE MANAGEMENT STUDIES,Effects of human capital on the relationship between export and firm innovation,,,https://scholar.google.com/scholar?q=Effects%20of%20human%20capital%20on%20the%20relationship%20between%20export%20and%20firm%20innovation,2,3,,,NO_PDF,,,NEED_R | NEED_N | NEED_FP | FIND_PDF_FIRST,,,,,,,,,,,source:wos,0
1210,1310,2017,INTERNATIONAL JOURNAL OF EMERGING MARKETS,Internationalization and performance of Indian born globals Moderating role of presence of foreign equity,,,https://scholar.google.com/scholar?q=Internationalization%20and%20performance%20of%20Indian%20born%20globals%20Moderating%20role%20of%20presence%20of%20foreign%20equity,3,3,composite,,NO_PDF,,,NEED_R | NEED_N | FIND_PDF_FIRST,,,,,,,,,,,source:multi,0
1218,1318,2018,BUSINESS STRATEGY AND THE ENVIRONMENT,Environmental innovation inertia: Analyzing the business circumstances for environmental process and product innovations,10.1002/bse.2228,https://doi.org/10.1002/bse.2228,https://scholar.google.com/scholar?q=Environmental%20innovation%20inertia%3A%20Analyzing%20the%20business%20circumstances%20for%20environmental%20process%20and%20product%20innovations,1,3,composite,,NO_PDF,,,NEED_R | NEED_N | FIND_PDF_FIRST,,,,,,,,,,,source:wos,0
1233,1333,2019,INTERNATIONAL JOURNAL OF CONTEMPORARY HOSPITALITY MANAGEMENT,Role of resource slack in rapid international expansion of restaurant companies,10.1108/ijchm-07-2017-0415,https://doi.org/10.1108/ijchm-07-2017-0415,https://scholar.google.com/scholar?q=Role%20of%20resource%20slack%20in%20rapid%20international%20expansion%20of%20restaurant%20companies,1,,,,NO_PDF,,,NEED_R | NEED_N | NEED_FP | FIND_PDF_FIRST,,,,,,,,,,,source:wos,
1273,1373,2019,JOURNAL OF AGRICULTURAL SCIENCE AND TECHNOLOGY,Effect of Marketing Strategies on Export Performance of Agricultural Products: The Case of Saffron in Iran,,,https://scholar.google.com/scholar?q=Effect%20of%20Marketing%20Strategies%20on%20Export%20Performance%20of%20Agricultural%20Products%3A%20The%20Case%20of%20Saffron%20in%20Iran,2,3,composite,,NO_PDF,,,NEED_R | NEED_N | FIND_PDF_FIRST,,,,,,,,,,,source:multi,0
1290,1390,2019,INTERNATIONAL JOURNAL OF WINE BUSINESS RESEARCH,Family culture and organisational systems as antecedents of market orientation and performance among family wineries,,,https://scholar.google.com/scholar?q=Family%20culture%20and%20organisational%20systems%20as%20antecedents%20of%20market%20orientation%20and%20performance%20among%20family%20wineries,1,,,,NO_PDF,,,NEED_R | NEED_N | NEED_FP | FIND_PDF_FIRST,,,,,,,,,,,source:wos,
1297,1397,2019,GLOBAL ECONOMY JOURNAL,"PERFORMANCE OF INDIAN CEMENT INDUSTRY: DRIVERS, MODELS AND EMPIRICS",10.1142/s219456591950009x,https://doi.org/10.1142/s219456591950009x,https://scholar.google.com/scholar?q=PERFORMANCE%20OF%20INDIAN%20CEMENT%20INDUSTRY%3A%20DRIVERS%2C%20MODELS%20AND%20EMPIRICS,3,3,composite,,NO_PDF,,,NEED_R | NEED_N | FIND_PDF_FIRST,,,,,,,,panel,,,source:multi,0
1301,1401,2019,ENTREPRENEURSHIP THEORY AND PRACTICE,African Business Groups: How Does Group Affiliation Improve SMEs' Export Intensity?,10.1177/1042258718779586,https://doi.org/10.1177/1042258718779586,https://scholar.google.com/scholar?q=African%20Business%20Groups%3A%20How%20Does%20Group%20Affiliation%20Improve%20SMEs%27%20Export%20Intensity%3F,0,3,,,NO_PDF,,,NEED_R | NEED_N | NEED_FP | FIND_PDF_FIRST,,,,,,,,,,,source:wos,0
1302,1402,2020,APPLIED ECONOMICS,The impact of OFDI on the performance of Chinese firms along the 'Belt and Road',10.1080/00036846.2019.1659501,https://doi.org/10.1080/00036846.2019.1659501,https://scholar.google.com/scholar?q=The%20impact%20of%20OFDI%20on%20the%20performance%20of%20Chinese%20firms%20along%20the%20%27Belt%20and%20Road%27,2,3,composite,,NO_PDF,,,NEED_R | NEED_N | FIND_PDF_FIRST,,,,,,,,,,,source:wos,0
1328,1428,2019,JOURNAL OF INTERNATIONAL MANAGEMENT,The effects of international diversification on the link between product diversification and performance in a boom and bust cycle: Evidence from Spanish firms (1994-2014),10.1016/j.intman.2019.100687,https://doi.org/10.1016/j.intman.2019.100687,https://scholar.google.com/scholar?q=The%20effects%20of%20international%20diversification%20on%20the%20link%20between%20product%20diversification%20and%20performance%20in%20a%20boom%20and%20b,1,3,composite,,NO_PDF,,,NEED_R | NEED_N | FIND_PDF_FIRST,,,,,,,,,,,source:multi,0
1346,1446,2020,RESEARCH IN INTERNATIONAL BUSINESS AND FINANCE,Do foreign investments increase firm value and firm performance? Evidence from Japan,10.1016/j.ribaf.2019.101099,https://doi.org/10.1016/j.ribaf.2019.101099,https://scholar.google.com/scholar?q=Do%20foreign%20investments%20increase%20firm%20value%20and%20firm%20performance%3F%20Evidence%20from%20Japan,1,3,composite,,NO_PDF,,,NEED_R | NEED_N | FIND_PDF_FIRST,,,,,,,,,,,source:multi,0
1354,1454,2020,MANAGEMENT DECISION,The effect of inter- and intra-regional geographic diversification strategies on firm performance in China,10.1108/md-01-2018-0104,https://doi.org/10.1108/md-01-2018-0104,https://scholar.google.com/scholar?q=The%20effect%20of%20inter-%20and%20intra-regional%20geographic%20diversification%20strategies%20on%20firm%20performance%20in%20China,1,3,composite,,NO_PDF,,,NEED_R | NEED_N | FIND_PDF_FIRST,,,,,,,,panel,,,source:wos,0
1355,1455,2020,BALTIC JOURNAL OF MANAGEMENT,Human capital and export performance in the Spanish manufacturing firms,,,https://scholar.google.com/scholar?q=Human%20capital%20and%20export%20performance%20in%20the%20Spanish%20manufacturing%20firms,1,3,composite,,NO_PDF,,,NEED_R | NEED_N | FIND_PDF_FIRST,,,,,,,,,,,source:wos,0
1362,1462,2020,SUSTAINABILITY,"Impact of Innovation Culture, Organization Size and Technological Capability on the Performance of SMEs: The Case of China",10.3390/su12041355,https://doi.org/10.3390/su12041355,https://scholar.google.com/scholar?q=Impact%20of%20Innovation%20Culture%2C%20Organization%20Size%20and%20Technological%20Capability%20on%20the%20Performance%20of%20SMEs%3A%20The%20Case%20of%20Chi,2,,,,NO_PDF,,,NEED_R | NEED_N | NEED_FP | FIND_PDF_FIRST,,,,,,,,,,,source:wos,
1369,1469,2020,MULTINATIONAL BUSINESS REVIEW,Foreign venture capital firms and internationalization of ventures,10.1108/mbr-09-2019-0104,https://doi.org/10.1108/mbr-09-2019-0104,https://scholar.google.com/scholar?q=Foreign%20venture%20capital%20firms%20and%20internationalization%20of%20ventures,1,3,composite,,NO_PDF,,,NEED_R | NEED_N | FIND_PDF_FIRST,,,,,,,,,,,source:multi,0
1370,1470,2020,INDIAN GROWTH AND DEVELOPMENT REVIEW,Conventional procedure <i>vis-a-vis</i> bootstrap-based corrections of efficiency analyses,,,https://scholar.google.com/scholar?q=Conventional%20procedure%20%3Ci%3Evis-a-vis%3C/i%3E%20bootstrap-based%20corrections%20of%20efficiency%20analyses,3,3,productivity,,NO_PDF,,,NEED_R | NEED_N | FIND_PDF_FIRST,,,,,,,,ols,,,source:multi,0
1372,1472,2020,SUSTAINABILITY,Impact of Logistics Capacity on Economic Sustainability of SMEs,,,https://scholar.google.com/scholar?q=Impact%20of%20Logistics%20Capacity%20on%20Economic%20Sustainability%20of%20SMEs,2,,,,NO_PDF,,,NEED_R | NEED_N | NEED_FP | FIND_PDF_FIRST,,,,,,,,,,,source:multi,
1375,1475,2020,ASIAN JOURNAL OF TECHNOLOGY INNOVATION,Dynamic process: international diversification and innovation performance from emerging economies,10.1080/19761597.2020.1726781,https://doi.org/10.1080/19761597.2020.1726781,https://scholar.google.com/scholar?q=Dynamic%20process%3A%20international%20diversification%20and%20innovation%20performance%20from%20emerging%20economies,0,3,composite,,NO_PDF,,,NEED_R | NEED_N | FIND_PDF_FIRST,,,,,,,,,,,source:wos,0
1380,1480,2020,JOURNAL OF ENTREPRENEURSHIP,Dimensional Impact of Social Capital on Financial Performance of SMEs,,,https://scholar.google.com/scholar?q=Dimensional%20Impact%20of%20Social%20Capital%20on%20Financial%20Performance%20of%20SMEs,0,,,,NO_PDF,,,NEED_R | NEED_N | NEED_FP | FIND_PDF_FIRST,,,,,,,,,,,source:wos,
1381,1481,2020,MARKETING INTELLIGENCE & PLANNING,International expansion: mediation of dynamic capabilities,,,https://scholar.google.com/scholar?q=International%20expansion%3A%20mediation%20of%20dynamic%20capabilities,1,3,composite,,NO_PDF,,,NEED_R | NEED_N | FIND_PDF_FIRST,,,,,,,,sem,,,source:multi,0
1401,1501,2019,INDIAN GROWTH AND DEVELOPMENT REVIEW,Trade liberalization and productivity of Indian manufacturing firms,10.1108/igdr-10-2018-0108,https://doi.org/10.1108/igdr-10-2018-0108,https://scholar.google.com/scholar?q=Trade%20liberalization%20and%20productivity%20of%20Indian%20manufacturing%20firms,3,3,productivity,,NO_PDF,,,NEED_R | NEED_N | FIND_PDF_FIRST,,,,,,,,panel,,,source:multi,0
1406,1506,2020,INTERNATIONAL JOURNAL OF SOCIAL ECONOMICS,Human capital and export performance of small and medium enterprises in Pakistan,10.1108/ijse-03-2019-0198,https://doi.org/10.1108/ijse-03-2019-0198,https://scholar.google.com/scholar?q=Human%20capital%20and%20export%20performance%20of%20small%20and%20medium%20enterprises%20in%20Pakistan,3,3,composite,,NO_PDF,,,NEED_R | NEED_N | FIND_PDF_FIRST,,,,,,,,,,,source:wos,0
1427,1527,2021,ENGINEERING CONSTRUCTION AND ARCHITECTURAL MANAGEMENT,Product diversification and large construction firm productivity: the effect of institutional environments in Malaysia,10.1108/ecam-05-2020-0288,https://doi.org/10.1108/ecam-05-2020-0288,https://scholar.google.com/scholar?q=Product%20diversification%20and%20large%20construction%20firm%20productivity%3A%20the%20effect%20of%20institutional%20environments%20in%20Malaysia,2,,,,NO_PDF,,,NEED_R | NEED_N | NEED_FP | FIND_PDF_FIRST,,,,,,,,,,,source:wos,
1447,1547,2020,SUSTAINABILITY,Does Gender Diversity Affect Performance in Agri-Food Cooperatives? A Moderated Model,,,https://scholar.google.com/scholar?q=Does%20Gender%20Diversity%20Affect%20Performance%20in%20Agri-Food%20Cooperatives%3F%20A%20Moderated%20Model,1,3,composite,,NO_PDF,,,NEED_R | NEED_N | FIND_PDF_FIRST,,,,,,,,,,,source:wos,0
1448,1548,2021,COMPETITIVENESS REVIEW,Understanding the connection between SMEs' competitiveness and cash flow generation: an empirical analysis from Hungary,10.1108/cr-01-2020-0019,https://doi.org/10.1108/cr-01-2020-0019,https://scholar.google.com/scholar?q=Understanding%20the%20connection%20between%20SMEs%27%20competitiveness%20and%20cash%20flow%20generation%3A%20an%20empirical%20analysis%20from%20Hungary,1,,,,NO_PDF,,,NEED_R | NEED_N | NEED_FP | FIND_PDF_FIRST,,,,,,,,,,,source:wos,
1458,1558,2021,JOURNAL OF AGRIBUSINESS IN DEVELOPING AND EMERGING ECONOMIES,Innovation and firm growth in agricultural inputs industry: empirical evidence from India,10.1108/jadee-07-2020-0156,https://doi.org/10.1108/jadee-07-2020-0156,https://scholar.google.com/scholar?q=Innovation%20and%20firm%20growth%20in%20agricultural%20inputs%20industry%3A%20empirical%20evidence%20from%20India,3,3,composite,,NO_PDF,,,NEED_R | NEED_N | FIND_PDF_FIRST,,,,,,,,panel,,,source:multi,0
1463,1563,2021,BUSINESS STRATEGY AND THE ENVIRONMENT,Environmental policies and financial performance: stock market reaction to firms for their proactive environmental practices recognized by governmental programs,10.1002/bse.2693,https://doi.org/10.1002/bse.2693,https://scholar.google.com/scholar?q=Environmental%20policies%20and%20financial%20performance%3A%20stock%20market%20reaction%20to%20firms%20for%20their%20proactive%20environmental%20pract,2,3,composite,,NO_PDF,,,NEED_R | NEED_N | FIND_PDF_FIRST,,,,,,,,ols,,,source:multi,0
1478,1578,2020,MANAGEMENT INTERNATIONAL REVIEW,Chinese Service Multinationals: The Degree of Internationalization and Performance,,,https://scholar.google.com/scholar?q=Chinese%20Service%20Multinationals%3A%20The%20Degree%20of%20Internationalization%20and%20Performance,2,3,composite,,NO_PDF,,,NEED_R | NEED_N | FIND_PDF_FIRST,,,,,,,,,,,source:multi,0
1479,1579,2023,ASIAN BUSINESS & MANAGEMENT,Performance implications of combining innovation and internationalization for Korean small- and medium-sized manufacturing firms: an exploration-exploitation perspective,10.1057/s41291-020-00144-w,https://doi.org/10.1057/s41291-020-00144-w,https://scholar.google.com/scholar?q=Performance%20implications%20of%20combining%20innovation%20and%20internationalization%20for%20Korean%20small-%20and%20medium-sized%20manufacturi,1,3,composite,,NO_PDF,,,NEED_R | NEED_N | FIND_PDF_FIRST,,,,,,,,,,,source:multi,0
1483,1583,2020,INNOVATION & MANAGEMENT REVIEW,Top management capabilities and performance of halal product,,,https://scholar.google.com/scholar?q=Top%20management%20capabilities%20and%20performance%20of%20halal%20product,2,3,composite,,NO_PDF,,,NEED_R | NEED_N | FIND_PDF_FIRST,,,,,,,,,,,source:multi,0
1485,1585,2021,COMPETITIVENESS REVIEW,Measuring competitiveness through the global competitiveness project framework: the Brazilian experience,10.1108/cr-12-2019-0164,https://doi.org/10.1108/cr-12-2019-0164,https://scholar.google.com/scholar?q=Measuring%20competitiveness%20through%20the%20global%20competitiveness%20project%20framework%3A%20the%20Brazilian%20experience,0,,,,NO_PDF,,,NEED_R | NEED_N | NEED_FP | FIND_PDF_FIRST,,,,,,,,,,,source:multi,
1490,1590,2020,JOURNAL OF INTERNATIONAL MANAGEMENT,Modelling the effects of institutional support and international knowledge on competitive capabilities and international performance: Evidence from an emerging economy,10.1016/j.intman.2020.100779,https://doi.org/10.1016/j.intman.2020.100779,https://scholar.google.com/scholar?q=Modelling%20the%20effects%20of%20institutional%20support%20and%20international%20knowledge%20on%20competitive%20capabilities%20and%20international,0,3,composite,,NO_PDF,,,NEED_R | NEED_N | FIND_PDF_FIRST,,,,,,,,,,,source:multi,0
1495,1595,2022,JOURNAL OF BUSINESS & INDUSTRIAL MARKETING,Making better foreign friendships: the effects of increased cultural diversity in alliance portfolios and portfolio configuration decisions on firm performance,10.1108/jbim-08-2020-0396,https://doi.org/10.1108/jbim-08-2020-0396,https://scholar.google.com/scholar?q=Making%20better%20foreign%20friendships%3A%20the%20effects%20of%20increased%20cultural%20diversity%20in%20alliance%20portfolios%20and%20portfolio%20conf,0,3,composite,,NO_PDF,,,NEED_R | NEED_N | FIND_PDF_FIRST,,,,,,,,,,,source:wos,0
1503,1603,2021,INTERNATIONAL JOURNAL OF INNOVATION SCIENCE,Does investment in innovation impact firm performance in emerging economies? An empirical investigation of the Indian food and agricultural manufacturing industry,10.1108/ijis-07-2020-0104,https://doi.org/10.1108/ijis-07-2020-0104,https://scholar.google.com/scholar?q=Does%20investment%20in%20innovation%20impact%20firm%20performance%20in%20emerging%20economies%3F%20An%20empirical%20investigation%20of%20the%20Indian%20fo,3,3,composite,,NO_PDF,,,NEED_R | NEED_N | FIND_PDF_FIRST,,,,,,,,,,,source:multi,0
1509,1609,2021,JOURNAL OF MANAGEMENT,Using the Resource-Based View in Multinational Enterprise Research,,,https://scholar.google.com/scholar?q=Using%20the%20Resource-Based%20View%20in%20Multinational%20Enterprise%20Research,0,3,composite,,NO_PDF,,,NEED_R | NEED_N | FIND_PDF_FIRST,,,,,,,,,,,source:multi,0
1529,1629,2020,VISION-THE JOURNAL OF BUSINESS PERSPECTIVE,Automotive Components Industry and Profitability Factors: Evidence from India,10.1177/0972262920955007,https://doi.org/10.1177/0972262920955007,https://scholar.google.com/scholar?q=Automotive%20Components%20Industry%20and%20Profitability%20Factors%3A%20Evidence%20from%20India,3,3,,,NO_PDF,,,NEED_R | NEED_N | NEED_FP | FIND_PDF_FIRST,,,,,,,,panel,,,source:multi,0
1540,1640,2021,EUROPEAN BUSINESS REVIEW,Validating multidimensional entrepreneurial orientation in emerging economies,10.1108/ebr-07-2020-0184,https://doi.org/10.1108/ebr-07-2020-0184,https://scholar.google.com/scholar?q=Validating%20multidimensional%20entrepreneurial%20orientation%20in%20emerging%20economies,0,,,,NO_PDF,,,NEED_R | NEED_N | NEED_FP | FIND_PDF_FIRST,,,,,,,,,,,source:wos,
1546,1646,2022,JOURNAL OF FAMILY BUSINESS MANAGEMENT,The contribution of the external director for Brazilian private family business: a generational approach,10.1108/jfbm-05-2021-0042,https://doi.org/10.1108/jfbm-05-2021-0042,https://scholar.google.com/scholar?q=The%20contribution%20of%20the%20external%20director%20for%20Brazilian%20private%20family%20business%3A%20a%20generational%20approach,2,,,,NO_PDF,,,NEED_R | NEED_N | NEED_FP | FIND_PDF_FIRST,,,,,,,,,,,source:wos,
1550,1650,2023,INTERNATIONAL JOURNAL OF EMERGING MARKETS,The relationship between cross-border acquisitions and R&D investments by Indian firms - substituting or complementing,10.1108/ijoem-08-2020-0913,https://doi.org/10.1108/ijoem-08-2020-0913,https://scholar.google.com/scholar?q=The%20relationship%20between%20cross-border%20acquisitions%20and%20R%26D%20investments%20by%20Indian%20firms%20-%20substituting%20or%20complementing,0,,,,NO_PDF,,,NEED_R | NEED_N | NEED_FP | FIND_PDF_FIRST,,,,,,,,,,,source:wos,
1575,1675,2021,EUROPEAN JOURNAL OF INTERNATIONAL MANAGEMENT,Testing critical levels in product and geographic diversification: a structural threshold approach,10.1504/ejim.2021.117522,https://doi.org/10.1504/ejim.2021.117522,https://scholar.google.com/scholar?q=Testing%20critical%20levels%20in%20product%20and%20geographic%20diversification%3A%20a%20structural%20threshold%20approach,1,3,composite,,NO_PDF,,,NEED_R | NEED_N | FIND_PDF_FIRST,,,,,,,,,,,source:wos,0
1578,1678,2021,ECONOMICS BULLETIN,International R&D teams: Performance effects and the moderating role of technological competences,,,https://scholar.google.com/scholar?q=International%20R%26D%20teams%3A%20Performance%20effects%20and%20the%20moderating%20role%20of%20technological%20competences,0,,,,NO_PDF,,,NEED_R | NEED_N | NEED_FP | FIND_PDF_FIRST,,,,,,,,,,,source:wos,
1580,1680,2023,EUROPEAN JOURNAL OF INNOVATION MANAGEMENT,Intangible resources and firms' innovation performance: empirical evidence from Chinese firms,10.1108/ejim-04-2021-0197,https://doi.org/10.1108/ejim-04-2021-0197,https://scholar.google.com/scholar?q=Intangible%20resources%20and%20firms%27%20innovation%20performance%3A%20empirical%20evidence%20from%20Chinese%20firms,2,3,composite,,NO_PDF,,,NEED_R | NEED_N | FIND_PDF_FIRST,,,,,,,,,,,source:wos,0
